Rank,Title,URL,Score,Genres,Episodes,Premiered,Studio,Type,Source
1080,Heike Monogatari,https://myanimelist.net/anime/49738/Heike_Monogatari,7.78,"Drama, Supernatural, Historical, Samurai",11,Winter 2022,Science SARU,TV,Source not found
1081,Innocence,https://myanimelist.net/anime/468/Innocence,7.78,"Action, Award Winning, Mystery, Sci-Fi, Suspense, Adult Cast, Detective, Mecha, Military, Psychological, Seinen",1,Premiered season not found,Production I.G,Movie,Manga
1082,Isekai Ojisan,https://myanimelist.net/anime/49220/Isekai_Ojisan,7.78,"Comedy, Fantasy, Adult Cast, Isekai, Otaku Culture, Parody",13,Summer 2022,AtelierPontdarc,TV,Web manga
1083,Aria the Crepuscolo,https://myanimelist.net/anime/41674/Aria_the_Crepuscolo,7.77,"Fantasy, Sci-Fi, Slice of Life, Iyashikei, Shounen",1,Premiered season not found,J.C.Staff,Movie,Manga
1084,Beastars 2nd Season,https://myanimelist.net/anime/40935/Beastars_2nd_Season,7.77,"Drama, Suspense, Anthropomorphic, Psychological, School, Shounen",12,Winter 2021,Orange,TV,Manga
1085,Break Blade Movie 3: Kyoujin no Ato,https://myanimelist.net/anime/9252/Break_Blade_Movie_3__Kyoujin_no_Ato,7.77,"Action, Fantasy, Adult Cast, Mecha, Military, Shounen",1,Premiered season not found,Production I.G,Movie,Manga
1086,"Clannad: After Story - Mou Hitotsu no Sekai, Kyou-hen",https://myanimelist.net/anime/6351/Clannad__After_Story_-_Mou_Hitotsu_no_Sekai_Kyou-hen,7.77,"Drama, Romance, School",1,Premiered season not found,Kyoto Animation,Special,Source not found
1087,Fanren Xiu Xian Chuan: Xinghai Feichi Pian Xuzhang,https://myanimelist.net/anime/55993/Fanren_Xiu_Xian_Chuan__Xinghai_Feichi_Pian_Xuzhang,7.77,"Action, Adventure, Fantasy, Historical, Martial Arts",4,Premiered season not found,Original Force,ONA,Source not found
1088,Ginga Tetsudou 999,https://myanimelist.net/anime/1491/Ginga_Tetsudou_999,7.77,"Adventure, Drama, Sci-Fi, Space",113,Fall 1978,Toei Animation,TV,Manga
1089,Gochuumon wa Usagi desu ka??,https://myanimelist.net/anime/29787/Gochuumon_wa_Usagi_desu_ka,7.77,"Slice of Life, CGDCT, Iyashikei, Workplace",12,Fall 2015,Kinema Citrus,TV,4-koma manga
1090,Hoozuki no Reitetsu,https://myanimelist.net/anime/20431/Hoozuki_no_Reitetsu,7.77,"Comedy, Fantasy, Mythology, Seinen",13,Winter 2014,Wit Studio,TV,Manga
1091,Lupin III: Part II,https://myanimelist.net/anime/1425/Lupin_III__Part_II,7.77,"Action, Adventure, Comedy, Mystery, Adult Cast, Seinen",155,Fall 1977,Tokyo Movie Shinsha,TV,Manga
1092,Magic Kaito,https://myanimelist.net/anime/8310/Magic_Kaito,7.77,"Adventure, Comedy, Romance, Shounen",12,Premiered season not found,TMS Entertainment,TV Special,Manga
1093,One Piece Movie 06: Omatsuri Danshaku to Himitsu no Shima,https://myanimelist.net/anime/464/One_Piece_Movie_06__Omatsuri_Danshaku_to_Himitsu_no_Shima,7.77,"Action, Adventure, Drama, Fantasy, Shounen",1,Premiered season not found,Toei Animation,Movie,Manga
1094,Pokemon XY&Z,https://myanimelist.net/anime/31592/Pokemon_XY_Z,7.77,"Action, Adventure, Comedy, Fantasy, Kids",47,Fall 2015,OLM,TV,Source not found
1095,Saiyuuki Gaiden,https://myanimelist.net/anime/9088/Saiyuuki_Gaiden,7.77,"Action, Adventure, Drama, Fantasy, Mythology, Shounen",3,Premiered season not found,Anpro,OVA,Manga
1096,Seitokai Yakuindomo Movie 2,https://myanimelist.net/anime/40814/Seitokai_Yakuindomo_Movie_2,7.77,"Comedy, Gag Humor, School, Shounen",1,Premiered season not found,GoHands,Movie,4-koma manga
1097,Undead Unluck,https://myanimelist.net/anime/52741/Undead_Unluck,7.77,"Action, Comedy, Super Power, Shounen",24,Fall 2023,David Production,TV,Manga
1098,Yuru Yuri Nachuyachumi!+,https://myanimelist.net/anime/30902/Yuru_Yuri_Nachuyachumi_,7.77,"Comedy, Girls Love, CGDCT, Gag Humor",2,Premiered season not found,TYO Animations,TV Special,Manga
1099,Zom 100: Zombie ni Naru made ni Shitai 100 no Koto,https://myanimelist.net/anime/54112/Zom_100__Zombie_ni_Naru_made_ni_Shitai_100_no_Koto,7.77,"Action, Comedy, Horror, Suspense, Adult Cast, Gore, Survival, Seinen",12,Summer 2023,BUG FILMS,TV,Manga
1100,"Tadaima, Okaeri",https://myanimelist.net/anime/56768/Tadaima_Okaeri,7.76,"Boys Love, Slice of Life, Childcare",12,Spring 2024,Studio Deen,TV,Manga
1101,Tentai Senshi Sunred,https://myanimelist.net/anime/5005/Tentai_Senshi_Sunred,7.76,"Comedy, Gag Humor, Parody, Super Power, Seinen",26,Fall 2008,AIC ASTA,TV,Manga
1102,Texhnolyze,https://myanimelist.net/anime/26/Texhnolyze,7.76,"Avant Garde, Drama, Mystery, Sci-Fi, Suspense, Adult Cast, Organized Crime, Psychological",22,Spring 2003,Madhouse,TV,Source not found
1103,Tomo-chan wa Onnanoko!,https://myanimelist.net/anime/52305/Tomo-chan_wa_Onnanoko,7.76,"Comedy, Romance, School",13,Winter 2023,Lay-duce,TV,Web manga
1104,Tonikaku Kawaii: Joshikou-hen,https://myanimelist.net/anime/55651/Tonikaku_Kawaii__Joshikou-hen,7.76,"Comedy, Romance, Shounen",4,Premiered season not found,Seven Arcs,ONA,Manga
1105,Zan Sayonara Zetsubou Sensei Bangaichi,https://myanimelist.net/anime/7044/Zan_Sayonara_Zetsubou_Sensei_Bangaichi,7.76,"Comedy, Gag Humor, Parody, School, Shounen",2,Premiered season not found,Shaft,OVA,Manga
1106,Akagami no Shirayuki-hime,https://myanimelist.net/anime/30123/Akagami_no_Shirayuki-hime,7.76,"Drama, Romance, Medical, Shoujo",12,Summer 2015,Bones,TV,Manga
1107,Bishoujo Senshi Sailor Moon Crystal Season III,https://myanimelist.net/anime/31733/Bishoujo_Senshi_Sailor_Moon_Crystal_Season_III,7.76,"Romance, Mahou Shoujo, Shoujo",13,Spring 2016,Toei Animation,TV,Manga
1108,Cardcaptor Sakura: Clear Card-hen Prologue - Sakura to Futatsu no Kuma,https://myanimelist.net/anime/35320/Cardcaptor_Sakura__Clear_Card-hen_Prologue_-_Sakura_to_Futatsu_no_Kuma,7.76,"Romance, Mahou Shoujo, Shoujo",1,Premiered season not found,Madhouse,OVA,Manga
1109,Date A Live IV,https://myanimelist.net/anime/41461/Date_A_Live_IV,7.76,"Action, Fantasy, Romance, Sci-Fi, Harem, School",12,Spring 2022,Geek Toys,TV,Light novel
1110,Edogawa Conan Shissou Jiken: Shijou Saiaku no Futsukakan,https://myanimelist.net/anime/21867/Edogawa_Conan_Shissou_Jiken__Shijou_Saiaku_no_Futsukakan,7.76,"Adventure, Comedy, Mystery, Detective, Shounen",1,Premiered season not found,TMS Entertainment,TV Special,Manga
1111,Hadashi no Gen,https://myanimelist.net/anime/1824/Hadashi_no_Gen,7.76,"Award Winning, Drama, Historical, Shounen",1,Premiered season not found,Madhouse,Movie,Manga
1112,Hibike! Euphonium Movie 3: Chikai no Finale,https://myanimelist.net/anime/35678/Hibike_Euphonium_Movie_3__Chikai_no_Finale,7.76,"Drama, Music, Performing Arts, School",1,Premiered season not found,Kyoto Animation,Movie,Source not found
1113,Hidamari Sketch x SP,https://myanimelist.net/anime/11237/Hidamari_Sketch_x_SP,7.76,"Slice of Life, CGDCT, Iyashikei, School, Visual Arts",2,Premiered season not found,Shaft,TV Special,4-koma manga
1114,Kara no Kyoukai Movie 2: Satsujin Kousatsu (Zen),https://myanimelist.net/anime/3782/Kara_no_Kyoukai_Movie_2__Satsujin_Kousatsu_Zen,7.76,"Action, Fantasy, Mystery, Romance, Suspense, Urban Fantasy",1,Premiered season not found,ufotable,Movie,Light novel
1115,Kuroko no Basket Movie 2: Winter Cup - Namida no Saki e,https://myanimelist.net/anime/32870/Kuroko_no_Basket_Movie_2__Winter_Cup_-_Namida_no_Saki_e,7.76,"Sports, School, Team Sports, Shounen",1,Premiered season not found,Production I.G,Movie,Manga
1116,Love Live! School Idol Project 2nd Season,https://myanimelist.net/anime/19111/Love_Live_School_Idol_Project_2nd_Season,7.76,"Award Winning, Slice of Life, Idols (Female), Music, School",13,Spring 2014,Sunrise,TV,Source not found
1117,Lupin the Third: Mine Fujiko to Iu Onna,https://myanimelist.net/anime/13203/Lupin_the_Third__Mine_Fujiko_to_Iu_Onna,7.76,"Action, Adventure, Award Winning, Comedy, Ecchi, Adult Cast, Samurai, Seinen",13,Spring 2012,TMS Entertainment,TV,Manga
1118,Mahoutsukai no Yome Season 2,https://myanimelist.net/anime/52955/Mahoutsukai_no_Yome_Season_2,7.76,"Drama, Fantasy, Romance, Mythology, School, Urban Fantasy, Shounen",12,Spring 2023,Studio Kafka,TV,Manga
1119,Meitantei Conan Movie 24: Hiiro no Dangan,https://myanimelist.net/anime/39764/Meitantei_Conan_Movie_24__Hiiro_no_Dangan,7.76,"Action, Comedy, Drama, Mystery, Detective, Shounen",1,Premiered season not found,TMS Entertainment,Movie,Manga
1120,Monogatari Series: Off & Monster Season - Zankoku Douwa: Utsukushi-hime,https://myanimelist.net/anime/59612/Monogatari_Series__Off___Monster_Season_-_Zankoku_Douwa__Utsukushi-hime,7.76,"Mystery, Supernatural, Suspense, Psychological, Vampire",1,Premiered season not found,Shaft,ONA,Light novel
1121,Ranma ½,https://myanimelist.net/anime/210/Ranma_%C2%BD,7.76,"Action, Comedy, Romance, Ecchi, Magical Sex Shift, Martial Arts, School, Shounen",161,Spring 1989,Studio Deen,TV,Manga
1122,Saenai Heroine no Sodatekata ♭,https://myanimelist.net/anime/30727/Saenai_Heroine_no_Sodatekata_%E2%99%AD,7.76,"Comedy, Romance, Ecchi, Harem, Otaku Culture, School",11,Spring 2017,A-1 Pictures,TV,Light novel
1123,Saint Seiya,https://myanimelist.net/anime/1254/Saint_Seiya,7.76,"Action, Adventure, Fantasy, Sci-Fi, Mythology, Shounen",114,Fall 1986,Toei Animation,TV,Manga
1124,Saint Seiya: Meiou Hades Meikai-hen,https://myanimelist.net/anime/1253/Saint_Seiya__Meiou_Hades_Meikai-hen,7.76,"Action, Adventure, Fantasy, Sci-Fi, Mythology, Shounen",12,Premiered season not found,Toei Animation,OVA,Manga
1125,Kidou Senshi Gundam,https://myanimelist.net/anime/80/Kidou_Senshi_Gundam,7.75,"Action, Drama, Sci-Fi, Mecha, Military, Space",43,Spring 1979,Sunrise,TV,Source not found
1126,Kidou Senshi Gundam III: Meguriai Sora-hen,https://myanimelist.net/anime/1092/Kidou_Senshi_Gundam_III__Meguriai_Sora-hen,7.75,"Action, Adventure, Drama, Sci-Fi, Mecha, Military, Space",1,Premiered season not found,Sunrise,Movie,Source not found
1127,Kimi no Koto ga Daidaidaidaidaisuki na 100-nin no Kanojo,https://myanimelist.net/anime/54714/Kimi_no_Koto_ga_Daidaidaidaidaisuki_na_100-nin_no_Kanojo,7.75,"Comedy, Romance, Harem, Parody, School, Seinen",12,Fall 2023,Bibury Animation Studios,TV,Manga
1128,Kubikiri Cycle: Aoiro Savant to Zaregotozukai,https://myanimelist.net/anime/33263/Kubikiri_Cycle__Aoiro_Savant_to_Zaregotozukai,7.75,"Drama, Mystery, Supernatural, Adult Cast",8,Premiered season not found,Shaft,OVA,Light novel
1129,Kumichou Musume to Sewagakari,https://myanimelist.net/anime/49776/Kumichou_Musume_to_Sewagakari,7.75,"Slice of Life, Childcare, Organized Crime",12,Summer 2022,feel.,TV,Web manga
1130,Kuroko no Basket Movie 1: Winter Cup - Kage to Hikari,https://myanimelist.net/anime/32869/Kuroko_no_Basket_Movie_1__Winter_Cup_-_Kage_to_Hikari,7.75,"Sports, School, Team Sports, Shounen",1,Premiered season not found,Production I.G,Movie,Manga
1131,Liang Bu Yi,https://myanimelist.net/anime/41221/Liang_Bu_Yi,7.75,"Comedy, Romance, Historical",24,Premiered season not found,Paper Plane Animation Studio,ONA,Web manga
1132,Lucky☆Star,https://myanimelist.net/anime/1887/Lucky%E2%98%86Star,7.75,"Comedy, CGDCT, Gag Humor, Otaku Culture, School",24,Spring 2007,Kyoto Animation,TV,4-koma manga
1133,Lupin III vs. Meitantei Conan,https://myanimelist.net/anime/6115/Lupin_III_vs_Meitantei_Conan,7.75,"Action, Adventure, Comedy, Mystery, Shounen",1,Premiered season not found,TMS Entertainment,TV Special,Manga
1134,Maria-sama ga Miteru 4th,https://myanimelist.net/anime/3750/Maria-sama_ga_Miteru_4th,7.75,"Drama, Girls Love, School, Shoujo",13,Winter 2009,Studio Deen,TV,Light novel
1135,Meitantei Conan OVA 10: Kid in Trap Island,https://myanimelist.net/anime/8609/Meitantei_Conan_OVA_10__Kid_in_Trap_Island,7.75,"Adventure, Comedy, Mystery, Detective, Shounen",1,Premiered season not found,TMS Entertainment,OVA,Manga
1136,Ni Tian Xieshen,https://myanimelist.net/anime/55745/Ni_Tian_Xieshen,7.75,"Action, Fantasy, Historical, Martial Arts",30,Premiered season not found,Foch Film,ONA,Source not found
1137,Overlord II,https://myanimelist.net/anime/35073/Overlord_II,7.75,"Action, Adventure, Fantasy, Isekai",13,Winter 2018,Madhouse,TV,Light novel
1139,Princess Connect! Re:Dive Season 2,https://myanimelist.net/anime/42670/Princess_Connect_Re_Dive_Season_2,7.75,"Adventure, Comedy, Fantasy, Gourmet",12,Winter 2022,CygamesPictures,TV,Source not found
1140,Saraiya Goyou,https://myanimelist.net/anime/7588/Saraiya_Goyou,7.75,"Drama, Adult Cast, Historical, Samurai, Seinen",12,Spring 2010,Manglobe,TV,Manga
1141,Seishun Buta Yarou wa Odekake Sister no Yume wo Minai,https://myanimelist.net/anime/53129/Seishun_Buta_Yarou_wa_Odekake_Sister_no_Yume_wo_Minai,7.75,"Drama, Romance, Supernatural, School",1,Premiered season not found,CloverWorks,Movie,Light novel
1142,Seitokai Yakuindomo OVA,https://myanimelist.net/anime/10119/Seitokai_Yakuindomo_OVA,7.75,"Comedy, Gag Humor, School, Shounen",8,Premiered season not found,GoHands,OVA,4-koma manga
1143,Sekaiichi Hatsukoi: Valentine-hen,https://myanimelist.net/anime/20815/Sekaiichi_Hatsukoi__Valentine-hen,7.75,"Boys Love, Adult Cast, Workplace",1,Premiered season not found,Studio Deen,Movie,Manga
1144,Shiki Specials,https://myanimelist.net/anime/10083/Shiki_Specials,7.75,"Horror, Mystery, Supernatural, Suspense, Gore, Psychological, Vampire, Shounen",2,Premiered season not found,Daume,Special,Manga
1145,Taiyou no Ko Esteban,https://myanimelist.net/anime/1279/Taiyou_no_Ko_Esteban,7.75,"Adventure, Sci-Fi, Historical",39,Spring 1982,Pierrot,TV,Source not found
1146,Tianbao Fuyao Lu 2nd Season,https://myanimelist.net/anime/44068/Tianbao_Fuyao_Lu_2nd_Season,7.75,"Action, Adventure, Comedy, Fantasy, Historical, Mythology",13,Premiered season not found,Sparkly Key Animation Studio,ONA,Source not found
1147,Wind Breaker,https://myanimelist.net/anime/54900/Wind_Breaker,7.75,"Action, Delinquents, School",13,Spring 2024,CloverWorks,TV,Web manga
1148,Xingchen Bian 5th Season,https://myanimelist.net/anime/51769/Xingchen_Bian_5th_Season,7.75,"Action, Adventure, Fantasy, Romance, Martial Arts",28,Premiered season not found,Foch Film,ONA,Source not found
1149,Charlotte,https://myanimelist.net/anime/28999/Charlotte,7.75,"Drama, School, Super Power",13,Summer 2015,P.A. Works,TV,Source not found
1150,City Hunter '91,https://myanimelist.net/anime/1473/City_Hunter_91,7.75,"Action, Comedy, Mystery, Shounen",13,Spring 1991,Sunrise,TV,Manga
1151,Devilman: Crybaby,https://myanimelist.net/anime/35120/Devilman__Crybaby,7.75,"Action, Avant Garde, Horror, Supernatural, Gore, Mythology, Shounen",10,Premiered season not found,Science SARU,ONA,Manga
1152,Dragon Ball Kai,https://myanimelist.net/anime/6033/Dragon_Ball_Kai,7.75,"Action, Adventure, Comedy, Fantasy, Martial Arts, Super Power, Shounen",97,Spring 2009,Toei Animation,TV,Manga
1153,Gakkou no Kaidan,https://myanimelist.net/anime/1281/Gakkou_no_Kaidan,7.75,"Horror, Mystery, Supernatural",19,Fall 2000,Pierrot,TV,Source not found
1154,Gakuen Babysitters Special,https://myanimelist.net/anime/37959/Gakuen_Babysitters_Special,7.75,"Slice of Life, Childcare, Iyashikei, Shoujo",1,Premiered season not found,Brain's Base,Special,Manga
1155,Gochuumon wa Usagi desu ka?? Sing for You,https://myanimelist.net/anime/38333/Gochuumon_wa_Usagi_desu_ka_Sing_for_You,7.75,"Slice of Life, CGDCT, Iyashikei, Workplace",1,Premiered season not found,production doA,OVA,4-koma manga
1156,High Score Girl,https://myanimelist.net/anime/21877/High_Score_Girl,7.75,"Comedy, Love Polygon, Love Status Quo, School, Video Game, Seinen",12,Summer 2018,J.C.Staff,TV,Manga
1157,BanG Dream! Garupa☆Pico,https://myanimelist.net/anime/37873/BanG_Dream_Garupa%E2%98%86Pico,7.74,"Comedy, Music",26,Premiered season not found,SANZIGEN,ONA,Source not found
1158,Bishoujo Senshi Sailor Moon,https://myanimelist.net/anime/530/Bishoujo_Senshi_Sailor_Moon,7.74,"Romance, Mahou Shoujo, Mythology, Shoujo",46,Spring 1992,Toei Animation,TV,Manga
1159,Bishoujo Senshi Sailor Moon Eternal Movie 2,https://myanimelist.net/anime/40429/Bishoujo_Senshi_Sailor_Moon_Eternal_Movie_2,7.74,"Romance, Mahou Shoujo, Shoujo",1,Premiered season not found,Toei Animation,Movie,Manga
1160,Colorful (Movie),https://myanimelist.net/anime/8142/Colorful_Movie,7.74,"Award Winning, Drama, Reincarnation",1,Premiered season not found,Sunrise,Movie,Source not found
1161,Dungeon ni Deai wo Motomeru no wa Machigatteiru Darou ka IV: Shin Shou - Meikyuu-hen,https://myanimelist.net/anime/47164/Dungeon_ni_Deai_wo_Motomeru_no_wa_Machigatteiru_Darou_ka_IV__Shin_Shou_-_Meikyuu-hen,7.74,"Action, Adventure, Fantasy",11,Summer 2022,J.C.Staff,TV,Light novel
1162,Fate/Grand Carnival,https://myanimelist.net/anime/44248/Fate_Grand_Carnival,7.74,"Comedy, Fantasy, Parody",4,Premiered season not found,Lerche,OVA,Source not found
1163,Fate/Grand Order: Shuukyoku Tokuiten - Kani Jikan Shinden Solomon,https://myanimelist.net/anime/41497/Fate_Grand_Order__Shuukyoku_Tokuiten_-_Kani_Jikan_Shinden_Solomon,7.74,"Action, Fantasy, Isekai",1,Premiered season not found,CloverWorks,Movie,Source not found
1164,Free! Movie 4: The Final Stroke - Zenpen,https://myanimelist.net/anime/38400/Free_Movie_4__The_Final_Stroke_-_Zenpen,7.74,"Sports, School",1,Premiered season not found,Kyoto Animation,Movie,Source not found
1165,Free! Take Your Marks,https://myanimelist.net/anime/35198/Free_Take_Your_Marks,7.74,"Slice of Life, School",1,Premiered season not found,Kyoto Animation,Movie,Source not found
1166,Genshiken 2,https://myanimelist.net/anime/2508/Genshiken_2,7.74,"Slice of Life, Adult Cast, Otaku Culture, Parody, Seinen",12,Fall 2007,Arms,TV,Manga
1167,Ghost Hunt,https://myanimelist.net/anime/1571/Ghost_Hunt,7.74,"Horror, Mystery, Supernatural, Shoujo",25,Fall 2006,J.C.Staff,TV,Manga
1168,Golden Time,https://myanimelist.net/anime/17895/Golden_Time,7.74,"Drama, Romance, Adult Cast, Love Polygon",24,Fall 2013,J.C.Staff,TV,Light novel
1169,Grisaia no Rakuen,https://myanimelist.net/anime/29095/Grisaia_no_Rakuen,7.74,"Drama, Romance, Suspense, Harem, Psychological",10,Spring 2015,8bit,TV,Source not found
1170,Gundam Build Fighters,https://myanimelist.net/anime/19319/Gundam_Build_Fighters,7.74,"Action, Sci-Fi, Mecha",25,Fall 2013,Sunrise,TV,Source not found
1171,Higashi no Eden,https://myanimelist.net/anime/5630/Higashi_no_Eden,7.74,"Award Winning, Mystery, Romance, Sci-Fi, Suspense, Adult Cast, Psychological",11,Spring 2009,Production I.G,TV,Source not found
1172,Huangjin Tingyuan: Dongri Li de Xinnian Yuanwang,https://myanimelist.net/anime/54035/Huangjin_Tingyuan__Dongri_Li_de_Xinnian_Yuanwang,7.74,Comedy,2,Premiered season not found,HuaMei Animation,ONA,Source not found
1173,Inazuma Eleven,https://myanimelist.net/anime/5231/Inazuma_Eleven,7.74,"Sports, Super Power, Team Sports",127,Fall 2008,OLM,TV,Source not found
1174,InuYasha: Kuroi Tessaiga,https://myanimelist.net/anime/4886/InuYasha__Kuroi_Tessaiga,7.74,"Action, Adventure, Fantasy, Romance, Historical, Mythology, Time Travel, Shounen",1,Premiered season not found,Sunrise,Special,Manga
1175,Kidou Senshi Gundam SEED,https://myanimelist.net/anime/93/Kidou_Senshi_Gundam_SEED,7.74,"Action, Award Winning, Drama, Romance, Sci-Fi, Mecha, Military, Space",50,Fall 2002,Sunrise,TV,Source not found
1176,Kino no Tabi: The Beautiful World - Nanika wo Suru Tame ni - Life Goes On.,https://myanimelist.net/anime/1379/Kino_no_Tabi__The_Beautiful_World_-_Nanika_wo_Suru_Tame_ni_-_Life_Goes_On,7.74,"Adventure, Drama, Fantasy",1,Premiered season not found,A.C.G.T.,Movie,Light novel
1177,Kuroko no Basket: Last Game NG-shuu,https://myanimelist.net/anime/35658/Kuroko_no_Basket__Last_Game_NG-shuu,7.74,"Comedy, Sports, Team Sports, Shounen",1,Premiered season not found,Production I.G,Special,Manga
1178,Little Witch Academia: Mahoujikake no Parade,https://myanimelist.net/anime/19489/Little_Witch_Academia__Mahoujikake_no_Parade,7.74,"Adventure, Comedy, Fantasy, School",1,Premiered season not found,Trigger,Movie,Source not found
1179,Mairimashita! Iruma-kun,https://myanimelist.net/anime/39196/Mairimashita_Iruma-kun,7.74,"Comedy, Fantasy, Isekai, School, Shounen",23,Fall 2019,Bandai Namco Pictures,TV,Manga
1180,Saiyuuki Reload: Burial,https://myanimelist.net/anime/2143/Saiyuuki_Reload__Burial,7.74,"Action, Adventure, Drama, Fantasy, Mythology, Shoujo",3,Premiered season not found,Pierrot,OVA,Manga
1181,Shokugeki no Souma: Shin no Sara,https://myanimelist.net/anime/39940/Shokugeki_no_Souma__Shin_no_Sara,7.74,"Gourmet, Ecchi, School, Shounen",12,Fall 2019,J.C.Staff,TV,Manga
1182,Tamayura: Sotsugyou Shashin Part 2 - Hibiki,https://myanimelist.net/anime/29829/Tamayura__Sotsugyou_Shashin_Part_2_-_Hibiki,7.74,"Slice of Life, CGDCT, Iyashikei",1,Premiered season not found,TYO Animations,Movie,Source not found
1183,Udon no Kuni no Kiniro Kemari,https://myanimelist.net/anime/32673/Udon_no_Kuni_no_Kiniro_Kemari,7.74,"Slice of Life, Supernatural, Anthropomorphic, Childcare, Iyashikei, Seinen",12,Fall 2016,LIDENFILMS,TV,Manga
1184,Shaman King,https://myanimelist.net/anime/154/Shaman_King,7.73,"Action, Adventure, Supernatural, Shounen",64,Summer 2001,Xebec,TV,Manga
1185,Shin Kidou Senki Gundam Wing: Endless Waltz,https://myanimelist.net/anime/91/Shin_Kidou_Senki_Gundam_Wing__Endless_Waltz,7.73,"Action, Award Winning, Drama, Sci-Fi, Mecha, Military, Space",3,Premiered season not found,Sunrise,OVA,Source not found
1186,Tantei Gakuen Q,https://myanimelist.net/anime/407/Tantei_Gakuen_Q,7.73,"Comedy, Drama, Mystery, Detective, Shounen",45,Spring 2003,Pierrot,TV,Manga
1187,Toshokan Sensou: Kakumei no Tsubasa,https://myanimelist.net/anime/11001/Toshokan_Sensou__Kakumei_no_Tsubasa,7.73,"Action, Comedy, Romance, Adult Cast, Military",1,Premiered season not found,Production I.G,Movie,Source not found
1188,Watashi no Shiawase na Kekkon,https://myanimelist.net/anime/51552/Watashi_no_Shiawase_na_Kekkon,7.73,"Drama, Fantasy, Romance, Adult Cast, Historical",12,Summer 2023,Kinema Citrus,TV,Source not found
1189,"Yahari Ore no Seishun Love Comedy wa Machigatteiru. Kan: Dakara, Shishunki wa Owarazu ni, Seishun wa Tsuzuiteiku.",https://myanimelist.net/anime/46431/Yahari_Ore_no_Seishun_Love_Comedy_wa_Machigatteiru_Kan__Dakara_Shishunki_wa_Owarazu_ni_Seishun_wa_Tsuzuiteiku,7.73,"Comedy, Romance, Love Polygon, School",1,Premiered season not found,feel.,OVA,Light novel
1190,Aggressive Retsuko (ONA) 2nd Season,https://myanimelist.net/anime/37985/Aggressive_Retsuko_ONA_2nd_Season,7.73,"Comedy, Anthropomorphic, Workplace",10,Premiered season not found,Fanworks,ONA,Source not found
1191,Ani ni Tsukeru Kusuri wa Nai! 2,https://myanimelist.net/anime/37924/Ani_ni_Tsukeru_Kusuri_wa_Nai_2,7.73,"Comedy, School",24,Summer 2018,Fanworks,TV,Web manga
1192,BanG Dream! Garupa☆Pico: Oomori,https://myanimelist.net/anime/40854/BanG_Dream_Garupa%E2%98%86Pico__Oomori,7.73,"Comedy, Music",26,Premiered season not found,SANZIGEN,ONA,Source not found
1193,Bishoujo Senshi Sailor Moon R,https://myanimelist.net/anime/740/Bishoujo_Senshi_Sailor_Moon_R,7.73,"Romance, Mahou Shoujo, Shoujo",43,Spring 1993,Toei Animation,TV,Manga
1194,Black Jack,https://myanimelist.net/anime/1520/Black_Jack,7.73,"Drama, Mystery, Suspense, Medical, Psychological, Shounen",12,Premiered season not found,Tezuka Productions,OVA,Manga
1195,Change!! Getter Robo: Sekai Saigo no Hi,https://myanimelist.net/anime/978/Change_Getter_Robo__Sekai_Saigo_no_Hi,7.73,"Action, Adventure, Horror, Sci-Fi, Mecha, Psychological, Shounen",13,Premiered season not found,Brain's Base,OVA,Manga
1196,Claymore,https://myanimelist.net/anime/1818/Claymore,7.73,"Action, Adventure, Fantasy, Gore, Shounen",26,Spring 2007,Madhouse,TV,Manga
1197,Dragon Quest: Dai no Daibouken (2020),https://myanimelist.net/anime/40906/Dragon_Quest__Dai_no_Daibouken_2020,7.73,"Action, Adventure, Fantasy, Shounen",100,Fall 2020,Toei Animation,TV,Manga
1198,Fanren Xiu Xian Chuan,https://myanimelist.net/anime/41219/Fanren_Xiu_Xian_Chuan,7.73,"Action, Adventure, Fantasy, Historical",17,Premiered season not found,Original Force,ONA,Source not found
1199,Free! Movie 3: Road to the World - Yume,https://myanimelist.net/anime/39014/Free_Movie_3__Road_to_the_World_-_Yume,7.73,"Sports, School",1,Premiered season not found,Kyoto Animation,Movie,Source not found
1200,Hug tto! Precure♡Futari wa Precure Movie: All Stars Memories,https://myanimelist.net/anime/37501/Hug_tto_Precure%E2%99%A1Futari_wa_Precure_Movie__All_Stars_Memories,7.73,"Action, Mahou Shoujo",1,Premiered season not found,Toei Animation,Movie,Source not found
1201,JoJo no Kimyou na Bouken: Phantom Blood,https://myanimelist.net/anime/3603/JoJo_no_Kimyou_na_Bouken__Phantom_Blood,7.73,"Action, Adventure, Horror, Vampire, Shounen",1,Premiered season not found,APPP,Movie,Manga
1202,Kageki Shoujo!!,https://myanimelist.net/anime/43691/Kageki_Shoujo,7.73,"Drama, Performing Arts, School, Shoujo",13,Summer 2021,PINE JAM,TV,Manga
1203,Kokoro Connect,https://myanimelist.net/anime/11887/Kokoro_Connect,7.73,"Drama, Romance, Supernatural, Love Polygon, School",13,Summer 2012,SILVER LINK.,TV,Light novel
1204,Koukaku Kidoutai: Stand Alone Complex - Solid State Society 3D,https://myanimelist.net/anime/10090/Koukaku_Kidoutai__Stand_Alone_Complex_-_Solid_State_Society_3D,7.73,"Action, Mystery, Sci-Fi, Adult Cast, Detective, Mecha, Military, Seinen",1,Premiered season not found,Production I.G,Movie,Manga
1205,Master Keaton OVA,https://myanimelist.net/anime/1910/Master_Keaton_OVA,7.73,"Adventure, Drama, Mystery, Adult Cast, Historical, Seinen",15,Premiered season not found,Madhouse,OVA,Manga
1206,Meitantei Conan Movie 19: Gouka no Himawari,https://myanimelist.net/anime/28479/Meitantei_Conan_Movie_19__Gouka_no_Himawari,7.73,"Action, Mystery, Detective, Shounen",1,Premiered season not found,TMS Entertainment,Movie,Manga
1207,Migi to Dali,https://myanimelist.net/anime/50586/Migi_to_Dali,7.73,"Comedy, Mystery, Suspense, Seinen",13,Fall 2023,Geek Toys,TV,Manga
1208,Panty & Stocking with Garterbelt,https://myanimelist.net/anime/8795/Panty___Stocking_with_Garterbelt,7.73,"Action, Comedy, Fantasy, Ecchi, Gag Humor, Parody",13,Fall 2010,Gainax,TV,Source not found
