Rank,Title,URL,Score,Genres,Episodes,Premiered,Studio,Type,Source
3049,Gakuen Utopia Manabi Straight!,https://myanimelist.net/anime/1858/Gakuen_Utopia_Manabi_Straight,7.25,"Comedy, Slice of Life, CGDCT, School",12,Winter 2007,ufotable,TV,Manga
3050,Genjitsu Shugi Yuusha no Oukoku Saikenki,https://myanimelist.net/anime/41710/Genjitsu_Shugi_Yuusha_no_Oukoku_Saikenki,7.25,"Action, Fantasy, Romance, Harem, Isekai, Military",13,Summer 2021,J.C.Staff,TV,Light novel
3051,Girls & Panzer: Saishuushou Part 4 Specials,https://myanimelist.net/anime/58606/Girls___Panzer__Saishuushou_Part_4_Specials,7.25,"Comedy, CGDCT, Military, School",2,Premiered season not found,Actas,Special,Source not found
3052,Gokushufudou,https://myanimelist.net/anime/43692/Gokushufudou,7.25,"Comedy, Adult Cast, Gag Humor, Organized Crime",5,Premiered season not found,J.C.Staff,ONA,Web manga
3053,Golden Kamuy OVA,https://myanimelist.net/anime/37884/Golden_Kamuy_OVA,7.25,"Action, Adventure, Adult Cast, Historical, Military, Seinen",1,Premiered season not found,Geno Studio,OVA,Manga
3054,Gun x Sword,https://myanimelist.net/anime/411/Gun_x_Sword,7.25,"Action, Adventure, Drama, Sci-Fi, Mecha",26,Summer 2005,AIC ASTA,TV,Source not found
3055,Gyokou no Nikuko-chan,https://myanimelist.net/anime/45620/Gyokou_no_Nikuko-chan,7.25,"Award Winning, Drama",1,Premiered season not found,Studio 4°C,Movie,Source not found
3056,Hana to Alice: Satsujin Jiken,https://myanimelist.net/anime/27969/Hana_to_Alice__Satsujin_Jiken,7.25,"Award Winning, Drama, Mystery",1,Premiered season not found,Steve N' Steven,Movie,Source not found
3057,Hetalia Axis Powers,https://myanimelist.net/anime/5060/Hetalia_Axis_Powers,7.25,"Comedy, Anthropomorphic, Gag Humor, Historical, Parody",52,Premiered season not found,Studio Deen,ONA,Web manga
3058,IGPX: Immortal Grand Prix (2005) 2nd Season,https://myanimelist.net/anime/1410/IGPX__Immortal_Grand_Prix_2005_2nd_Season,7.25,"Action, Sci-Fi, Mecha, Racing",13,Spring 2006,Production I.G,TV,Source not found
3059,Imouto sae Ireba Ii.,https://myanimelist.net/anime/35413/Imouto_sae_Ireba_Ii,7.25,"Comedy, Romance, Ecchi, Adult Cast, Otaku Culture, Workplace",12,Fall 2017,SILVER LINK.,TV,Light novel
3060,Jashin-chan Dropkick': Chitose-hen,https://myanimelist.net/anime/40661/Jashin-chan_Dropkick__Chitose-hen,7.25,"Comedy, Supernatural, Gag Humor, Mythology",1,Premiered season not found,Nomad,Special,Web manga
3061,Kakumeiki Valvrave 2nd Season,https://myanimelist.net/anime/18295/Kakumeiki_Valvrave_2nd_Season,7.25,"Action, Sci-Fi, Mecha, Military, Space",12,Fall 2013,Sunrise,TV,Source not found
3062,Kidou Senshi Gundam Thunderbolt: Bandit Flower,https://myanimelist.net/anime/35949/Kidou_Senshi_Gundam_Thunderbolt__Bandit_Flower,7.25,"Action, Drama, Sci-Fi, Mecha, Military, Space",1,Premiered season not found,Sunrise,Movie,Manga
3063,Kobayashi-san Chi no OO Dragon,https://myanimelist.net/anime/35145/Kobayashi-san_Chi_no_OO_Dragon,7.25,"Fantasy, Slice of Life",7,Premiered season not found,Kyoto Animation,Special,Manga
3064,Kowarekake no Orgel (Movie),https://myanimelist.net/anime/10918/Kowarekake_no_Orgel_Movie,7.25,"Drama, Sci-Fi, Music",1,Premiered season not found,Actas,Movie,Source not found
3065,Ling Jian Zun 4th Season,https://myanimelist.net/anime/41884/Ling_Jian_Zun_4th_Season,7.25,"Action, Adventure, Fantasy, Romance, Martial Arts",Unknown,Premiered season not found,Suoyi Technology,ONA,Source not found
3066,Love Live! School Idol Festival All Stars,https://myanimelist.net/anime/40246/Love_Live_School_Idol_Festival_All_Stars,7.25,Music,1,Premiered season not found,Sunrise,ONA,Source not found
3067,Matantei Loki Ragnarok,https://myanimelist.net/anime/335/Matantei_Loki_Ragnarok,7.25,"Comedy, Mystery, Supernatural, Mythology, Shounen",26,Spring 2003,Studio Deen,TV,Manga
3068,Meitantei Conan: Conan vs. Kid - Shikkoku no Sniper,https://myanimelist.net/anime/9786/Meitantei_Conan__Conan_vs_Kid_-_Shikkoku_no_Sniper,7.25,"Adventure, Comedy, Mystery, Detective, Shounen",1,Premiered season not found,add some,Movie,Manga
3069,Mononogatari,https://myanimelist.net/anime/50384/Mononogatari,7.25,"Action, Supernatural, Adult Cast, Mythology, Seinen",12,Winter 2023,Bandai Namco Pictures,TV,Manga
3070,Nanatsu no Taizai: Mokushiroku no Yonkishi,https://myanimelist.net/anime/51794/Nanatsu_no_Taizai__Mokushiroku_no_Yonkishi,7.25,"Action, Adventure, Fantasy, Shounen",24,Fall 2023,Telecom Animation Film,TV,Manga
3071,Noblesse: Pamyeol-ui Sijak,https://myanimelist.net/anime/32566/Noblesse__Pamyeol-ui_Sijak,7.25,"Action, Adventure, Supernatural",1,Premiered season not found,Studio Animal,OVA,Web manga
3072,Papa no Iukoto wo Kikinasai!,https://myanimelist.net/anime/11179/Papa_no_Iukoto_wo_Kikinasai,7.25,"Comedy, Romance, Childcare",12,Winter 2012,feel.,TV,Light novel
3073,Precure Miracle Leap Movie: Minna to no Fushigi na Ichinichi,https://myanimelist.net/anime/40587/Precure_Miracle_Leap_Movie__Minna_to_no_Fushigi_na_Ichinichi,7.25,"Action, Mahou Shoujo, Time Travel",1,Premiered season not found,Toei Animation,Movie,Source not found
3074,RideBack,https://myanimelist.net/anime/4618/RideBack,7.25,"Action, Drama, Sci-Fi, Mecha, School, Seinen",12,Winter 2009,Madhouse,TV,Manga
3075,Sabage-bu! Specials,https://myanimelist.net/anime/25647/Sabage-bu_Specials,7.25,"Action, Comedy, CGDCT, School, Shoujo",6,Premiered season not found,Pierrot Plus,Special,Manga
3076,Sayonara Ginga Tetsudou 999: Andromeda Shuuchakueki,https://myanimelist.net/anime/1302/Sayonara_Ginga_Tetsudou_999__Andromeda_Shuuchakueki,7.25,"Adventure, Drama, Sci-Fi, Space",1,Premiered season not found,Toei Animation,Movie,Manga
3077,Jiyi Guanli Ju,https://myanimelist.net/anime/50462/Jiyi_Guanli_Ju,7.24,"Action, Mystery, Psychological, Super Power",1,Premiered season not found,Flint Sugar,ONA,Source not found
3078,JoJo no Kimyou na Bouken: Adventure,https://myanimelist.net/anime/665/JoJo_no_Kimyou_na_Bouken__Adventure,7.24,"Action, Adventure, Drama, Super Power, Vampire, Shounen",7,Premiered season not found,APPP,OVA,Manga
3079,Kaidan Restaurant,https://myanimelist.net/anime/6980/Kaidan_Restaurant,7.24,"Horror, Mystery, Supernatural, Kids",23,Fall 2009,Toei Animation,TV,Source not found
3080,Kaiketsu Zorro,https://myanimelist.net/anime/3010/Kaiketsu_Zorro,7.24,"Adventure, Historical",52,Spring 1996,Ashi Productions,TV,Source not found
3081,Kami no Tou: Koubou-sen,https://myanimelist.net/anime/59989/Kami_no_Tou__Koubou-sen,7.24,"Action, Adventure, Drama, Fantasy, Mystery",Unknown,Fall 2024,The Answer Studio,TV,Web manga
3082,Kidou Senshi Gundam I,https://myanimelist.net/anime/1090/Kidou_Senshi_Gundam_I,7.24,"Action, Adventure, Drama, Sci-Fi, Mecha, Military, Space",1,Premiered season not found,Sunrise,Movie,Source not found
3083,Kyouran Kazoku Nikki,https://myanimelist.net/anime/3577/Kyouran_Kazoku_Nikki,7.24,"Comedy, Sci-Fi",26,Spring 2008,Nomad,TV,Light novel
3084,MÄR,https://myanimelist.net/anime/738/M%C3%84R,7.24,"Action, Adventure, Comedy, Fantasy, Isekai, Shounen",102,Spring 2005,SynergySP,TV,Manga
3085,Meitantei Conan OVA 05: Hyouteki wa Kogorou!! Shounen Tanteidan Maruchichousa,https://myanimelist.net/anime/2515/Meitantei_Conan_OVA_05__Hyouteki_wa_Kogorou_Shounen_Tanteidan_Maruchichousa,7.24,"Adventure, Comedy, Mystery, Detective, Shounen",1,Premiered season not found,TMS Entertainment,OVA,Manga
3086,Mnemosyne: Mnemosyne no Musume-tachi,https://myanimelist.net/anime/3342/Mnemosyne__Mnemosyne_no_Musume-tachi,7.24,"Action, Girls Love, Horror, Sci-Fi, Supernatural, Adult Cast, Gore",6,Winter 2008,Xebec,TV,Source not found
3087,Nabari no Ou,https://myanimelist.net/anime/3655/Nabari_no_Ou,7.24,"Action, Drama, Supernatural, Martial Arts, Shounen",26,Spring 2008,J.C.Staff,TV,Manga
3088,One Piece: Adventure of Nebulandia,https://myanimelist.net/anime/32051/One_Piece__Adventure_of_Nebulandia,7.24,"Action, Adventure, Fantasy, Shounen",1,Premiered season not found,Toei Animation,TV Special,Manga
3089,Ou Dorobou Jing in Seventh Heaven,https://myanimelist.net/anime/108/Ou_Dorobou_Jing_in_Seventh_Heaven,7.24,"Adventure, Comedy, Fantasy, Psychological, Shounen",3,Premiered season not found,Studio Deen,OVA,Manga
3090,Petshop of Horrors,https://myanimelist.net/anime/326/Petshop_of_Horrors,7.24,"Horror, Mystery, Supernatural, Josei",4,Winter 1999,Madhouse,TV,Manga
3091,Planetarian: Snow Globe,https://myanimelist.net/anime/40778/Planetarian__Snow_Globe,7.24,"Drama, Sci-Fi",1,Premiered season not found,Okuruto Noboru,OVA,Source not found
3092,PriPara Movie: Mi~nna no Akogare♪ Let's Go☆Prix Paris,https://myanimelist.net/anime/31919/PriPara_Movie__Minna_no_Akogare%E2%99%AA_Lets_Go%E2%98%86Prix_Paris,7.24,"Slice of Life, Idols (Female), Music, School",1,Premiered season not found,Tatsunoko Production,Movie,Source not found
3093,Sei Juushi Bismarck,https://myanimelist.net/anime/2361/Sei_Juushi_Bismarck,7.24,"Action, Adventure, Sci-Fi, Mecha, Space",51,Fall 1984,Pierrot,TV,Source not found
3094,Shin Chou Kyou Ryo: Condor Hero II,https://myanimelist.net/anime/960/Shin_Chou_Kyou_Ryo__Condor_Hero_II,7.24,"Adventure, Drama, Romance, Historical",26,Winter 2005,Nippon Animation,TV,Source not found
3095,Sidonia no Kishi Movie,https://myanimelist.net/anime/28495/Sidonia_no_Kishi_Movie,7.24,"Action, Sci-Fi, Mecha, Space, Seinen",1,Premiered season not found,Polygon Pictures,Movie,Manga
3096,Tekken Chinmi,https://myanimelist.net/anime/4663/Tekken_Chinmi,7.24,"Action, Adventure, Historical, Martial Arts, Shounen",20,Summer 1988,Production Reed,TV,Manga
3097,Tetsuwan Birdy Decode: The Cipher,https://myanimelist.net/anime/6380/Tetsuwan_Birdy_Decode__The_Cipher,7.24,"Action, Comedy, Sci-Fi, Seinen",1,Premiered season not found,A-1 Pictures,OVA,Manga
3098,To LOVE-Ru OVA,https://myanimelist.net/anime/5667/To_LOVE-Ru_OVA,7.24,"Comedy, Romance, Sci-Fi, Ecchi, Harem, School, Shounen",6,Premiered season not found,Xebec,OVA,Manga
3099,Wan Jie Xian Zong 2nd Season,https://myanimelist.net/anime/39912/Wan_Jie_Xian_Zong_2nd_Season,7.24,"Action, Adventure, Fantasy, Romance, Historical, Martial Arts, Mythology",40,Premiered season not found,Ruo Hong Culture,ONA,Web manga
3100,"Wei, Kanjian Erduo La!",https://myanimelist.net/anime/38217/Wei_Kanjian_Erduo_La,7.24,"Boys Love, Comedy, Anthropomorphic",12,Premiered season not found,monofilmo,ONA,Web manga
3101,Witch Hunter Robin,https://myanimelist.net/anime/7/Witch_Hunter_Robin,7.24,"Action, Drama, Mystery, Supernatural, Detective",26,Summer 2002,Sunrise,TV,Source not found
3102,Wu Geng Ji Zhi San Jie,https://myanimelist.net/anime/38467/Wu_Geng_Ji_Zhi_San_Jie,7.24,"Action, Fantasy, Supernatural, Historical, Martial Arts",42,Premiered season not found,Sparkly Key Animation Studio,ONA,Manga
3103,"""Bungaku Shoujo"" Memoire",https://myanimelist.net/anime/8481/Bungaku_Shoujo_Memoire,7.24,"Drama, Romance, School",3,Premiered season not found,Production I.G,OVA,Light novel
3104,Aggressive Retsuko: We Wish You a Metal Christmas,https://myanimelist.net/anime/38815/Aggressive_Retsuko__We_Wish_You_a_Metal_Christmas,7.24,"Comedy, Anthropomorphic",1,Premiered season not found,Fanworks,ONA,Source not found
3105,Ajin Part 3: Shougeki,https://myanimelist.net/anime/30870/Ajin_Part_3__Shougeki,7.24,"Action, Horror, Mystery, Supernatural, Gore, Seinen",1,Premiered season not found,Polygon Pictures,Movie,Manga
3106,Alice to Therese no Maboroshi Koujou,https://myanimelist.net/anime/49303/Alice_to_Therese_no_Maboroshi_Koujou,7.24,"Award Winning, Drama",1,Premiered season not found,MAPPA,Movie,Source not found
3107,Amanchu!,https://myanimelist.net/anime/31771/Amanchu,7.24,"Slice of Life, Iyashikei, School, Shounen",12,Summer 2016,J.C.Staff,TV,Manga
3108,Appare-Ranman!,https://myanimelist.net/anime/40532/Appare-Ranman,7.24,"Comedy, Adult Cast, Historical, Racing",13,Spring 2020,P.A. Works,TV,Source not found
3109,Blood Lad,https://myanimelist.net/anime/11633/Blood_Lad,7.24,"Action, Comedy, Fantasy, Delinquents, Mythology, Vampire, Seinen",10,Summer 2013,Brain's Base,TV,Manga
3110,Bokura ga Ita,https://myanimelist.net/anime/1222/Bokura_ga_Ita,7.24,"Drama, Romance, Love Polygon, Shoujo",26,Summer 2006,Artland,TV,Manga
3111,Break Blade,https://myanimelist.net/anime/22433/Break_Blade,7.24,"Action, Fantasy, Adult Cast, Mecha, Military, Shounen",12,Spring 2014,Production I.G,TV,Manga
3112,Bubble,https://myanimelist.net/anime/50549/Bubble,7.24,"Action, Sci-Fi",1,Premiered season not found,Wit Studio,ONA,Source not found
3113,Clannad Movie,https://myanimelist.net/anime/1723/Clannad_Movie,7.24,"Drama, Romance, Supernatural, School",1,Premiered season not found,Toei Animation,Movie,Source not found
3114,Cuticle Tantei Inaba,https://myanimelist.net/anime/15109/Cuticle_Tantei_Inaba,7.24,"Comedy, Fantasy, Mystery, Detective, Gag Humor, Organized Crime, Urban Fantasy, Shounen",12,Winter 2013,Zexcs,TV,Manga
3115,Dinghai Fusheng Lu,https://myanimelist.net/anime/44065/Dinghai_Fusheng_Lu,7.24,"Action, Fantasy, Historical",12,Premiered season not found,Foch Film,ONA,Source not found
3116,Doraemon Movie 23: Nobita to Robot Kingdom,https://myanimelist.net/anime/2655/Doraemon_Movie_23__Nobita_to_Robot_Kingdom,7.24,"Adventure, Comedy, Fantasy, Kids, Shounen",1,Premiered season not found,Shin-Ei Animation,Movie,Manga
3117,Dungeon ni Deai wo Motomeru no wa Machigatteiru Darou ka II,https://myanimelist.net/anime/37347/Dungeon_ni_Deai_wo_Motomeru_no_wa_Machigatteiru_Darou_ka_II,7.24,"Action, Adventure, Fantasy",12,Summer 2019,J.C.Staff,TV,Light novel
3118,Erementar Gerad,https://myanimelist.net/anime/1250/Erementar_Gerad,7.24,"Action, Adventure, Fantasy, Romance, Super Power, Shounen",26,Spring 2005,Xebec,TV,Manga
3119,Fushigi Yuugi: Dai Ni Bu,https://myanimelist.net/anime/381/Fushigi_Yuugi__Dai_Ni_Bu,7.24,"Adventure, Fantasy, Romance, Historical, Isekai, Martial Arts, Shoujo",6,Premiered season not found,Pierrot,OVA,Manga
3120,Gekai Elise,https://myanimelist.net/anime/54632/Gekai_Elise,7.24,"Fantasy, Romance, Medical, Reincarnation",12,Winter 2024,Maho Film,TV,Web manga
3121,Hamatora The Animation,https://myanimelist.net/anime/20689/Hamatora_The_Animation,7.24,"Action, Mystery, Super Power",12,Winter 2014,NAZ,TV,Source not found
3122,Heavy Object,https://myanimelist.net/anime/27829/Heavy_Object,7.24,"Action, Sci-Fi, Mecha, Military",24,Fall 2015,J.C.Staff,TV,Light novel
3123,High School DxD Hero,https://myanimelist.net/anime/34281/High_School_DxD_Hero,7.24,"Action, Comedy, Romance, Supernatural, Ecchi, Harem, Mythology, School",12,Spring 2018,Passione,TV,Light novel
3124,Himouto! Umaru-chan OVA,https://myanimelist.net/anime/30991/Himouto_Umaru-chan_OVA,7.24,"Comedy, Otaku Culture, School, Seinen",2,Premiered season not found,Doga Kobo,OVA,Manga
3125,Asura Cryin' 2,https://myanimelist.net/anime/6676/Asura_Cryin_2,7.23,"Action, Fantasy, Sci-Fi, Harem, Mecha, School",13,Fall 2009,Seven Arcs,TV,Light novel
3126,Beelzebub-jou no Okinimesu mama.,https://myanimelist.net/anime/37716/Beelzebub-jou_no_Okinimesu_mama,7.23,"Comedy, Fantasy, Romance, Mythology, Workplace, Shounen",12,Fall 2018,LIDENFILMS,TV,4-koma manga
3127,Cheonnyeon-yeowoo Yeowoobi,https://myanimelist.net/anime/2756/Cheonnyeon-yeowoo_Yeowoobi,7.23,"Drama, Fantasy, Sci-Fi",1,Premiered season not found,Sunwoo Entertainment,Movie,Source not found
3128,Dae Jang Geum: Jang Geum's Dream,https://myanimelist.net/anime/1778/Dae_Jang_Geum__Jang_Geums_Dream,7.23,"Adventure, Comedy, Gourmet, Historical",26,Fall 2005,add some,TV,Source not found
3129,Damekko Doubutsu,https://myanimelist.net/anime/485/Damekko_Doubutsu,7.23,"Comedy, Slice of Life, Anthropomorphic",26,Winter 2005,Magic Bus,TV,4-koma manga
3130,Digimon Adventure 02,https://myanimelist.net/anime/1313/Digimon_Adventure_02,7.23,"Action, Adventure, Comedy, Fantasy, Isekai, Kids",50,Spring 2000,Toei Animation,TV,Source not found
3131,Dumbbell Nan Kilo Moteru?,https://myanimelist.net/anime/39026/Dumbbell_Nan_Kilo_Moteru,7.23,"Comedy, Ecchi, CGDCT",12,Summer 2019,Doga Kobo,TV,Web manga
3132,Fullmetal Alchemist: Reflections,https://myanimelist.net/anime/664/Fullmetal_Alchemist__Reflections,7.23,"Adventure, Comedy, Drama, Fantasy, Military, Shounen",1,Premiered season not found,Bones,Special,Manga
3133,Gatchaman Crowds Insight,https://myanimelist.net/anime/21039/Gatchaman_Crowds_Insight,7.23,"Action, Sci-Fi, Super Power",12,Summer 2015,Tatsunoko Production,TV,Source not found
3134,GJ-bu@,https://myanimelist.net/anime/21635/GJ-bu,7.23,"Comedy, Slice of Life, School",1,Premiered season not found,Doga Kobo,TV Special,Light novel
3135,GS Mikami,https://myanimelist.net/anime/2400/GS_Mikami,7.23,"Comedy, Supernatural, Shounen",45,Spring 1993,Toei Animation,TV,Manga
3136,Healin' Good♡Precure Movie: Yume no Machi de Kyun! Tto GoGo! Dai Henshin!!,https://myanimelist.net/anime/42422/Healin_Good%E2%99%A1Precure_Movie__Yume_no_Machi_de_Kyun_Tto_GoGo_Dai_Henshin,7.23,"Action, Mahou Shoujo",1,Premiered season not found,Toei Animation,Movie,Source not found
3137,Hyakko,https://myanimelist.net/anime/4550/Hyakko,7.23,"Comedy, Slice of Life, CGDCT, School",13,Fall 2008,Nippon Animation,TV,Manga
3138,"Ijiranaide, Nagatoro-san",https://myanimelist.net/anime/42361/Ijiranaide_Nagatoro-san,7.23,"Comedy, Love Status Quo, School",12,Spring 2021,Telecom Animation Film,TV,Web manga
3139,Inu to Neko Docchi mo Katteru to Mainichi Tanoshii,https://myanimelist.net/anime/40833/Inu_to_Neko_Docchi_mo_Katteru_to_Mainichi_Tanoshii,7.23,"Comedy, Slice of Life, Pets",24,Fall 2020,Team TillDawn,TV,Web manga
3140,Just Because!,https://myanimelist.net/anime/35639/Just_Because,7.23,"Drama, Romance, Love Polygon, School",12,Fall 2017,PINE JAM,TV,Source not found
3141,Kakegurui,https://myanimelist.net/anime/34933/Kakegurui,7.23,"Drama, Mystery, Suspense, High Stakes Game, Psychological, School, Strategy Game, Shounen",12,Summer 2017,MAPPA,TV,Manga
3142,Kidou Senshi Gundam Thunderbolt 2nd Season,https://myanimelist.net/anime/34391/Kidou_Senshi_Gundam_Thunderbolt_2nd_Season,7.23,"Action, Drama, Sci-Fi, Mecha, Military, Space",4,Premiered season not found,Sunrise,ONA,Manga
3143,Kimi wa Meido-sama.,https://myanimelist.net/anime/57611/Kimi_wa_Meido-sama,7.23,"Comedy, Romance",12,Fall 2024,Felix Film,TV,Web manga
3144,Kindaichi Shounen no Jikenbo Specials,https://myanimelist.net/anime/3245/Kindaichi_Shounen_no_Jikenbo_Specials,7.23,"Mystery, Shounen",2,Premiered season not found,Toei Animation,TV Special,Manga
3145,Kiniro Mosaic,https://myanimelist.net/anime/16732/Kiniro_Mosaic,7.23,"Slice of Life, CGDCT, School",12,Summer 2013,Studio Gokumi,TV,4-koma manga
3146,Kuma Kuma Kuma Bear,https://myanimelist.net/anime/40974/Kuma_Kuma_Kuma_Bear,7.23,"Adventure, Comedy, Fantasy, Isekai",12,Fall 2020,EMT Squared,TV,Light novel
3147,Kuroko no Basket: Oshaberi Demo Shimasen ka,https://myanimelist.net/anime/29583/Kuroko_no_Basket__Oshaberi_Demo_Shimasen_ka,7.23,"Comedy, Sports, School, Team Sports, Shounen",1,Premiered season not found,Production I.G,Special,Manga
3148,Layton Mystery Tanteisha: Katri no Nazotoki File,https://myanimelist.net/anime/37023/Layton_Mystery_Tanteisha__Katri_no_Nazotoki_File,7.23,"Comedy, Mystery, Kids",50,Spring 2018,LIDENFILMS,TV,Source not found
3149,Long Zu,https://myanimelist.net/anime/44408/Long_Zu,7.23,"Adventure, Fantasy",16,Premiered season not found,Garden Culture,ONA,Source not found
3150,Lupin III: Honoo no Kioku - Tokyo Crisis,https://myanimelist.net/anime/1437/Lupin_III__Honoo_no_Kioku_-_Tokyo_Crisis,7.23,"Action, Adventure, Comedy, Mystery, Adult Cast, Shounen",1,Premiered season not found,Tokyo Movie Shinsha,TV Special,Manga
3151,Mahoutsukai ni Taisetsu na Koto: Natsu no Sora,https://myanimelist.net/anime/4483/Mahoutsukai_ni_Taisetsu_na_Koto__Natsu_no_Sora,7.23,"Fantasy, Romance, Slice of Life, Iyashikei, Shounen",12,Summer 2008,HAL Film Maker,TV,Manga
3152,Mai-Otome Zwei,https://myanimelist.net/anime/1609/Mai-Otome_Zwei,7.23,Action,4,Premiered season not found,Sunrise,OVA,Source not found
3153,Maoyuu Maou Yuusha,https://myanimelist.net/anime/14833/Maoyuu_Maou_Yuusha,7.23,"Adventure, Fantasy, Romance",12,Winter 2013,Arms,TV,Light novel
3154,Masamune-kun no Revenge R,https://myanimelist.net/anime/51498/Masamune-kun_no_Revenge_R,7.23,"Comedy, Romance, Harem, School, Shounen",12,Summer 2023,SILVER LINK.,TV,Manga
3155,Meikyuu Black Company,https://myanimelist.net/anime/42340/Meikyuu_Black_Company,7.23,"Comedy, Fantasy, Isekai",12,Summer 2021,SILVER LINK.,TV,Web manga
3156,Meitantei Conan OVA 01: Conan vs. Kid vs. Yaiba - Houtou Soudatsu Daikessen!!,https://myanimelist.net/anime/1369/Meitantei_Conan_OVA_01__Conan_vs_Kid_vs_Yaiba_-_Houtou_Soudatsu_Daikessen,7.23,"Adventure, Comedy, Mystery, Shounen",1,Premiered season not found,TMS Entertainment,OVA,Manga
3157,Michi (Movie),https://myanimelist.net/anime/7616/Michi_Movie,7.23,"Drama, Slice of Life",4,Premiered season not found,Tomoyasu Murata Company,Movie,Source not found
3158,Natsu no Arashi!,https://myanimelist.net/anime/5597/Natsu_no_Arashi,7.23,"Comedy, Romance, Supernatural, Time Travel, Shounen",13,Spring 2009,Shaft,TV,Manga
3159,Nazo no Kanojo X,https://myanimelist.net/anime/12467/Nazo_no_Kanojo_X,7.23,"Romance, School, Seinen",13,Spring 2012,Hoods Entertainment,TV,Manga
3160,Ookiku Furikabutte: Kihon no Kihon,https://myanimelist.net/anime/3887/Ookiku_Furikabutte__Kihon_no_Kihon,7.23,"Drama, Sports, Team Sports, Seinen",1,Premiered season not found,A-1 Pictures,Special,Manga
3161,Phi Brain: Kami no Puzzle - Shukuteki! Rätsel-hen,https://myanimelist.net/anime/15651/Phi_Brain__Kami_no_Puzzle_-_Shukuteki_R%C3%A4tsel-hen,7.23,"Action, Mystery, Suspense, High Stakes Game, Strategy Game",25,Fall 2013,Sunrise,TV,Source not found
3162,Ranma ½: Chuugoku Nekonron Daikessen! Okite Yaburi no Gekitou-hen!!,https://myanimelist.net/anime/418/Ranma_%C2%BD__Chuugoku_Nekonron_Daikessen_Okite_Yaburi_no_Gekitou-hen,7.23,"Adventure, Comedy, Magical Sex Shift, Shounen",1,Premiered season not found,Studio Deen,Movie,Manga
3163,Semantic Error,https://myanimelist.net/anime/49202/Semantic_Error,7.23,"Boys Love, Slice of Life, Adult Cast",4,Premiered season not found,add some,ONA,Web manga
3164,Shijou Saikyou no Deshi Kenichi Specials,https://myanimelist.net/anime/24029/Shijou_Saikyou_no_Deshi_Kenichi_Specials,7.23,"Action, Comedy, Martial Arts, School, Shounen",4,Premiered season not found,Brain's Base,Special,Manga
3165,Sora no Otoshimono,https://myanimelist.net/anime/5958/Sora_no_Otoshimono,7.23,"Comedy, Fantasy, Romance, Sci-Fi, Ecchi, Harem, Shounen",13,Fall 2009,AIC ASTA,TV,Manga
3166,Subete ga F ni Naru,https://myanimelist.net/anime/28621/Subete_ga_F_ni_Naru,7.23,"Mystery, Sci-Fi, Suspense, Adult Cast, Detective, Psychological",11,Fall 2015,A-1 Pictures,TV,Source not found
3167,Suki tte Ii na yo. Dareka ga,https://myanimelist.net/anime/16868/Suki_tte_Ii_na_yo_Dareka_ga,7.23,"Romance, School, Shoujo",1,Premiered season not found,Zexcs,OVA,Manga
3168,Taisou Zamurai,https://myanimelist.net/anime/42668/Taisou_Zamurai,7.23,Sports,11,Fall 2020,MAPPA,TV,Source not found
3169,Trinity Seven Movie 1: Eternity Library to Alchemic Girl,https://myanimelist.net/anime/33581/Trinity_Seven_Movie_1__Eternity_Library_to_Alchemic_Girl,7.23,"Action, Comedy, Fantasy, Romance, Ecchi, Harem, School, Shounen",1,Premiered season not found,Seven Arcs Pictures,Movie,Manga
3170,Tsundere Akuyaku Reijou Liselotte to Jikkyou no Endou-kun to Kaisetsu no Kobayashi-san,https://myanimelist.net/anime/50652/Tsundere_Akuyaku_Reijou_Liselotte_to_Jikkyou_no_Endou-kun_to_Kaisetsu_no_Kobayashi-san,7.23,"Comedy, Fantasy, Romance, Video Game, Villainess",12,Winter 2023,Tezuka Productions,TV,Light novel
3171,Yeon-ae Halujeon,https://myanimelist.net/anime/42632/Yeon-ae_Halujeon,7.23,"Romance, Slice of Life",10,Premiered season not found,LICO,ONA,Source not found
3172,Yu☆Gi☆Oh!,https://myanimelist.net/anime/550/Yu%E2%98%86Gi%E2%98%86Oh,7.23,"Action, Comedy, Fantasy, Strategy Game, Shounen",27,Spring 1998,Toei Animation,TV,Manga
3173,Yume no Crayon Oukoku,https://myanimelist.net/anime/4651/Yume_no_Crayon_Oukoku,7.23,"Adventure, Comedy, Fantasy",70,Fall 1997,Toei Animation,TV,Source not found
3174,Zero no Tsukaima: Princesses no Rondo - Yuuwaku no Sunahama,https://myanimelist.net/anime/5764/Zero_no_Tsukaima__Princesses_no_Rondo_-_Yuuwaku_no_Sunahama,7.23,"Comedy, Fantasy, Ecchi, Harem, Isekai",1,Premiered season not found,J.C.Staff,Special,Light novel
3175,Sengoku Youko: Senma Konton-hen,https://myanimelist.net/anime/58488/Sengoku_Youko__Senma_Konton-hen,7.22,"Action, Adventure, Fantasy, Historical, Mythology, Shounen",22,Summer 2024,White Fox,TV,Manga
3176,Shimoneta to Iu Gainen ga Sonzai Shinai Taikutsu na Sekai,https://myanimelist.net/anime/29786/Shimoneta_to_Iu_Gainen_ga_Sonzai_Shinai_Taikutsu_na_Sekai,7.22,"Comedy, Ecchi, Gag Humor, School",12,Summer 2015,J.C.Staff,TV,Light novel
3177,Shin Chou Kyou Ryo: Condor Hero III,https://myanimelist.net/anime/5854/Shin_Chou_Kyou_Ryo__Condor_Hero_III,7.22,"Action, Adventure, Drama, Romance, Historical",26,Spring 2008,Nippon Animation,TV,Source not found
3178,Soukou Kihei Votoms: Pailsen Files,https://myanimelist.net/anime/3256/Soukou_Kihei_Votoms__Pailsen_Files,7.22,"Sci-Fi, Mecha, Military, Space",12,Premiered season not found,The Answer Studio,OVA,Source not found
3179,Strike the Blood: Valkyria no Oukoku-hen,https://myanimelist.net/anime/30321/Strike_the_Blood__Valkyria_no_Oukoku-hen,7.22,"Action, Fantasy, Ecchi, Harem, School, Urban Fantasy, Vampire",2,Premiered season not found,Barnum Studio,OVA,Light novel
3180,Super Lovers OVA,https://myanimelist.net/anime/33013/Super_Lovers_OVA,7.22,"Boys Love, Comedy, Drama",2,Premiered season not found,Studio Deen,OVA,Manga
3181,Suzumiya Haruhi no Yuuutsu (2009),https://myanimelist.net/anime/4382/Suzumiya_Haruhi_no_Yuuutsu_2009,7.22,"Comedy, Mystery, Sci-Fi, School",14,Spring 2009,Kyoto Animation,TV,Light novel
