Rank,Title,URL,Score,Genres,Episodes,Premiered,Studio,Type,Source
1991,Shinseiki Evangelion Movie: Shi to Shinsei,https://myanimelist.net/anime/31/Shinseiki_Evangelion_Movie__Shi_to_Shinsei,7.48,"Action, Drama, Sci-Fi, Suspense, Mecha, Psychological",1,Premiered season not found,Gainax,Movie,Source not found
1992,Sora no Aosa wo Shiru Hito yo,https://myanimelist.net/anime/39569/Sora_no_Aosa_wo_Shiru_Hito_yo,7.48,"Drama, Romance, Supernatural, Music, Time Travel",1,Premiered season not found,CloverWorks,Movie,Source not found
1993,Wangan Midnight,https://myanimelist.net/anime/2608/Wangan_Midnight,7.48,"Action, Racing, Seinen",26,Summer 2007,A.C.G.T.,TV,Manga
1994,Xian Wang de Richang Shenghuo 4,https://myanimelist.net/anime/53450/Xian_Wang_de_Richang_Shenghuo_4,7.48,"Adventure, Comedy, Fantasy, School",12,Premiered season not found,Liyu Culture,ONA,Source not found
1995,Yao Shen Ji 8th Season,https://myanimelist.net/anime/58744/Yao_Shen_Ji_8th_Season,7.48,"Action, Adventure, Comedy, Fantasy, Romance, Martial Arts, Mythology",52,Premiered season not found,Ruo Hong Culture,ONA,Source not found
1996,Yawara!,https://myanimelist.net/anime/691/Yawara,7.48,"Comedy, Romance, Sports, Combat Sports, Seinen",124,Fall 1989,Madhouse,TV,Manga
1997,Air Gear,https://myanimelist.net/anime/857/Air_Gear,7.48,"Sports, Ecchi, Delinquents, School, Shounen",25,Spring 2006,Toei Animation,TV,Manga
1998,Ani ni Tsukeru Kusuri wa Nai!,https://myanimelist.net/anime/35015/Ani_ni_Tsukeru_Kusuri_wa_Nai,7.48,"Comedy, School",12,Spring 2017,Fanworks,TV,Web manga
1999,Ao no Exorcist,https://myanimelist.net/anime/9919/Ao_no_Exorcist,7.48,"Action, Supernatural, Mythology, School, Shounen",25,Spring 2011,A-1 Pictures,TV,Manga
2000,Area 88,https://myanimelist.net/anime/1488/Area_88,7.48,"Action, Adventure, Drama, Romance, Military, Shounen",3,Premiered season not found,Pierrot,OVA,Manga
2001,Boku ga Aishita Subete no Kimi e,https://myanimelist.net/anime/49834/Boku_ga_Aishita_Subete_no_Kimi_e,7.48,"Romance, Sci-Fi",1,Premiered season not found,Bakken Record,Movie,Source not found
2002,Crayon Shin-chan Movie 10: Arashi wo Yobu Appare! Sengoku Daikassen,https://myanimelist.net/anime/3744/Crayon_Shin-chan_Movie_10__Arashi_wo_Yobu_Appare_Sengoku_Daikassen,7.48,"Award Winning, Drama, Romance, Historical, Samurai, Seinen",1,Premiered season not found,Shin-Ei Animation,Movie,Manga
2003,Demi-chan wa Kataritai: Demi-chan no Natsuyasumi,https://myanimelist.net/anime/35823/Demi-chan_wa_Kataritai__Demi-chan_no_Natsuyasumi,7.48,"Comedy, Fantasy, Mythology, School, Urban Fantasy, Vampire, Seinen",1,Premiered season not found,A-1 Pictures,ONA,Manga
2004,Denpa-teki na Kanojo,https://myanimelist.net/anime/5177/Denpa-teki_na_Kanojo,7.48,"Mystery, Suspense, School",2,Premiered season not found,Brain's Base,OVA,Light novel
2005,Futari-bun no Shoumei,https://myanimelist.net/anime/53933/Futari-bun_no_Shoumei,7.48,Drama,1,Premiered season not found,Flat Studio,ONA,Source not found
2006,Grappler Baki: Saidai Tournament-hen,https://myanimelist.net/anime/551/Grappler_Baki__Saidai_Tournament-hen,7.48,"Sports, Combat Sports, Gore, Shounen",24,Summer 2001,Group TAC,TV,Manga
2007,Gundam Build Divers Re:Rise 2nd Season,https://myanimelist.net/anime/40942/Gundam_Build_Divers_Re_Rise_2nd_Season,7.48,"Action, Sci-Fi, Mecha",13,Premiered season not found,Sunrise Beyond,ONA,Source not found
2008,"Haikara-san ga Tooru Movie 1: Benio, Hana no 17-sai",https://myanimelist.net/anime/33378/Haikara-san_ga_Tooru_Movie_1__Benio_Hana_no_17-sai,7.48,"Comedy, Romance, Historical, Shoujo",1,Premiered season not found,Nippon Animation,Movie,Manga
2009,Hokuto no Ken Zero: Kenshirou Den,https://myanimelist.net/anime/5291/Hokuto_no_Ken_Zero__Kenshirou_Den,7.48,"Action, Martial Arts, Shounen",1,Premiered season not found,TMS Entertainment,Movie,Manga
2010,Isekai Izakaya: Koto Aitheria no Izakaya Nobu,https://myanimelist.net/anime/34420/Isekai_Izakaya__Koto_Aitheria_no_Izakaya_Nobu,7.48,"Fantasy, Gourmet, Adult Cast, Isekai, Workplace",24,Premiered season not found,Sunrise,ONA,Light novel
2011,Acchi Kocchi,https://myanimelist.net/anime/12291/Acchi_Kocchi,7.47,"Comedy, Romance, Gag Humor, School",12,Spring 2012,AIC,TV,4-koma manga
2012,Aikatsu!,https://myanimelist.net/anime/15061/Aikatsu,7.47,"Slice of Life, Idols (Female), Music, School",178,Fall 2012,Sunrise,TV,Source not found
2013,Akame ga Kill!,https://myanimelist.net/anime/22199/Akame_ga_Kill,7.47,"Action, Fantasy, Gore, Shounen",24,Summer 2014,White Fox,TV,Manga
2014,Another,https://myanimelist.net/anime/11111/Another,7.47,"Horror, Mystery, Gore, School",12,Winter 2012,P.A. Works,TV,Source not found
2015,Bai She II: Qing She Jie Qi,https://myanimelist.net/anime/49409/Bai_She_II__Qing_She_Jie_Qi,7.47,"Adventure, Fantasy, Martial Arts, Mythology",1,Premiered season not found,Light Chaser Animation Studios,Movie,Source not found
2016,Bai She: Yuan Qi,https://myanimelist.net/anime/38740/Bai_She__Yuan_Qi,7.47,"Action, Adventure, Drama, Fantasy, Romance, Martial Arts, Mythology",1,Premiered season not found,Light Chaser Animation Studios,Movie,Source not found
2017,Da Yu Hai Tang (Movie),https://myanimelist.net/anime/10259/Da_Yu_Hai_Tang_Movie,7.47,"Adventure, Drama, Romance, Supernatural",1,Premiered season not found,B&T,Movie,Source not found
2018,Fate/stay night: Unlimited Blade Works 2nd Season - Sunny Day,https://myanimelist.net/anime/31389/Fate_stay_night__Unlimited_Blade_Works_2nd_Season_-_Sunny_Day,7.47,"Action, Fantasy, Urban Fantasy",1,Premiered season not found,ufotable,Special,Source not found
2019,Furiko,https://myanimelist.net/anime/13629/Furiko,7.47,"Drama, Romance, Music",1,Premiered season not found,add some,Special,Source not found
2020,High School DxD New,https://myanimelist.net/anime/15451/High_School_DxD_New,7.47,"Action, Comedy, Romance, Supernatural, Ecchi, Harem, Mythology, School",12,Summer 2013,TNK,TV,Light novel
2021,Hitoribocchi no Marumaru Seikatsu,https://myanimelist.net/anime/37614/Hitoribocchi_no_Marumaru_Seikatsu,7.47,"Comedy, CGDCT, School, Shounen",12,Spring 2019,C2C,TV,4-koma manga
2022,Honzuki no Gekokujou: Shisho ni Naru Tame ni wa Shudan wo Erandeiraremasen OVA,https://myanimelist.net/anime/40841/Honzuki_no_Gekokujou__Shisho_ni_Naru_Tame_ni_wa_Shudan_wo_Erandeiraremasen_OVA,7.47,"Fantasy, Isekai, Reincarnation",1,Premiered season not found,Ajia-do,OVA,Light novel
2023,"Ijiranaide, Nagatoro-san 2nd Attack",https://myanimelist.net/anime/50197/Ijiranaide_Nagatoro-san_2nd_Attack,7.47,"Comedy, Love Status Quo, School",12,Winter 2023,OLM,TV,Web manga
2024,Isekai Quartet Movie: Another World,https://myanimelist.net/anime/41567/Isekai_Quartet_Movie__Another_World,7.47,"Comedy, Fantasy, Isekai, Parody",1,Premiered season not found,Studio PuYUKAI,Movie,Source not found
2025,Jashin-chan Dropkick',https://myanimelist.net/anime/39049/Jashin-chan_Dropkick,7.47,"Comedy, Supernatural, Gag Humor, Mythology",11,Spring 2020,Nomad,TV,Web manga
2026,Kamisama no Memochou,https://myanimelist.net/anime/10568/Kamisama_no_Memochou,7.47,"Drama, Mystery",12,Summer 2011,J.C.Staff,TV,Light novel
2027,KanColle Movie,https://myanimelist.net/anime/31418/KanColle_Movie,7.47,"Action, Drama, Sci-Fi, Anthropomorphic, Military",1,Premiered season not found,Diomedéa,Movie,Source not found
2028,Kore wa Zombie desu ka? of the Dead,https://myanimelist.net/anime/10790/Kore_wa_Zombie_desu_ka_of_the_Dead,7.47,"Action, Comedy, Fantasy, Ecchi, Harem, Urban Fantasy, Vampire",10,Spring 2012,Studio Deen,TV,Light novel
2029,Koukaku Kidoutai Arise: Ghost in the Shell - Border:2 Ghost Whispers,https://myanimelist.net/anime/19191/Koukaku_Kidoutai_Arise__Ghost_in_the_Shell_-_Border_2_Ghost_Whispers,7.47,"Action, Mystery, Sci-Fi, Adult Cast, Detective, Mecha, Psychological",1,Premiered season not found,Production I.G,Movie,Manga
2030,Kyoukaisenjou no Horizon II,https://myanimelist.net/anime/12487/Kyoukaisenjou_no_Horizon_II,7.47,"Action, Fantasy, Sci-Fi",13,Summer 2012,Sunrise,TV,Light novel
2031,Ling Long: Incarnation Part 2,https://myanimelist.net/anime/42290/Ling_Long__Incarnation_Part_2,7.47,"Action, Drama, Horror, Sci-Fi, Suspense, Mythology",6,Premiered season not found,YHKT Entertainment,ONA,Source not found
2032,Madang-eul Naon Amtalg,https://myanimelist.net/anime/12917/Madang-eul_Naon_Amtalg,7.47,"Adventure, Drama, Fantasy, Anthropomorphic, Kids",1,Premiered season not found,Odolttogi,Movie,Source not found
2033,Meng Qi Shi Shen: Huanxi Zhui Hun,https://myanimelist.net/anime/51203/Meng_Qi_Shi_Shen__Huanxi_Zhui_Hun,7.47,"Comedy, Drama, Gourmet, Romance, Historical",12,Premiered season not found,Wawayu Animation,ONA,Source not found
2034,Psycho-Pass: Sinners of the System Case.2 - First Guardian,https://myanimelist.net/anime/37441/Psycho-Pass__Sinners_of_the_System_Case2_-_First_Guardian,7.47,"Action, Mystery, Sci-Fi, Suspense, Adult Cast, Detective, Psychological",1,Premiered season not found,Production I.G,Movie,Source not found
2035,Saenai Heroine no Sodatekata,https://myanimelist.net/anime/23277/Saenai_Heroine_no_Sodatekata,7.47,"Comedy, Romance, Ecchi, Harem, Otaku Culture, School",12,Winter 2015,A-1 Pictures,TV,Light novel
2036,Saint☆Oniisan,https://myanimelist.net/anime/15775/Saint%E2%98%86Oniisan,7.47,"Comedy, Slice of Life, Seinen",2,Premiered season not found,A-1 Pictures,OVA,Manga
2037,Sarazanmai,https://myanimelist.net/anime/37426/Sarazanmai,7.47,"Action, Supernatural, Anthropomorphic",11,Spring 2019,MAPPA,TV,Source not found
2038,Sayonara Zetsubou Sensei Special,https://myanimelist.net/anime/10469/Sayonara_Zetsubou_Sensei_Special,7.47,"Comedy, Mystery, Gag Humor, Parody, Shounen",1,Premiered season not found,Shaft,Special,Manga
2039,Sekaiichi Hatsukoi: Propose-hen,https://myanimelist.net/anime/40314/Sekaiichi_Hatsukoi__Propose-hen,7.47,"Boys Love, Adult Cast, Workplace",1,Premiered season not found,Studio Deen,Movie,Manga
2040,Shinryaku!! Ika Musume,https://myanimelist.net/anime/13267/Shinryaku_Ika_Musume,7.47,"Comedy, Anthropomorphic, Shounen",3,Premiered season not found,Diomedéa,OVA,Manga
2041,Shinryaku!? Ika Musume,https://myanimelist.net/anime/10378/Shinryaku_Ika_Musume,7.47,"Comedy, Anthropomorphic, Shounen",12,Fall 2011,Diomedéa,TV,Manga
2042,Sugar Apple Fairy Tale,https://myanimelist.net/anime/49980/Sugar_Apple_Fairy_Tale,7.47,"Adventure, Drama, Fantasy, Romance, Visual Arts, Shoujo",12,Winter 2023,J.C.Staff,TV,Light novel
2043,"Suteki desu wa, Sakura-chan! Tomoyo no Cardcaptor Sakura Katsuyaku Video Nikki!",https://myanimelist.net/anime/2424/Suteki_desu_wa_Sakura-chan_Tomoyo_no_Cardcaptor_Sakura_Katsuyaku_Video_Nikki,7.47,"Comedy, Mahou Shoujo, Shoujo",3,Premiered season not found,Madhouse,Special,Manga
2044,Tensei Oujo to Tensai Reijou no Mahou Kakumei,https://myanimelist.net/anime/52736/Tensei_Oujo_to_Tensai_Reijou_no_Mahou_Kakumei,7.47,"Fantasy, Girls Love, Isekai, Reincarnation",12,Winter 2023,Diomedéa,TV,Light novel
2045,Towa no Quon 5: Souzetsu no Raifuku,https://myanimelist.net/anime/10716/Towa_no_Quon_5__Souzetsu_no_Raifuku,7.47,"Action, Sci-Fi, Super Power",1,Premiered season not found,Bones,Movie,Source not found
2046,Tsurune Movie: Hajimari no Issha,https://myanimelist.net/anime/43556/Tsurune_Movie__Hajimari_no_Issha,7.47,"Sports, School",1,Premiered season not found,Kyoto Animation,Movie,Light novel
2047,Yuru Camp△ Season 2 Specials,https://myanimelist.net/anime/49026/Yuru_Camp%E2%96%B3_Season_2_Specials,7.47,"Slice of Life, CGDCT",2,Premiered season not found,C-Station,Special,Manga
2048,Zhe Tian,https://myanimelist.net/anime/51289/Zhe_Tian,7.47,"Action, Adventure, Sci-Fi",104,Premiered season not found,Original Force,ONA,Source not found
2049,Senki Zesshou Symphogear G,https://myanimelist.net/anime/15793/Senki_Zesshou_Symphogear_G,7.46,"Action, Sci-Fi, Idols (Female), Music",13,Summer 2013,Satelight,TV,Source not found
2050,"Tensei shitara Dainana Ouji Datta node, Kimama ni Majutsu wo Kiwamemasu",https://myanimelist.net/anime/53516/Tensei_shitara_Dainana_Ouji_Datta_node_Kimama_ni_Majutsu_wo_Kiwamemasu,7.46,"Adventure, Fantasy, Reincarnation",12,Spring 2024,Tsumugi Akita Animation Lab,TV,Light novel
2051,Tonari no Kaibutsu-kun,https://myanimelist.net/anime/14227/Tonari_no_Kaibutsu-kun,7.46,"Comedy, Romance, School, Shoujo",13,Fall 2012,Brain's Base,TV,Manga
2052,Waga Seishun no Arcadia,https://myanimelist.net/anime/2202/Waga_Seishun_no_Arcadia,7.46,"Action, Adventure, Drama, Sci-Fi, Adult Cast, Space",1,Premiered season not found,Toei Animation,Movie,Source not found
2053,Xiao Lu He Xiao Lan,https://myanimelist.net/anime/38250/Xiao_Lu_He_Xiao_Lan,7.46,"Boys Love, Comedy, Drama, Sci-Fi, School",72,Premiered season not found,Haoliners Animation League,ONA,Web manga
2054,Youjo Senki: Sabaku no Pasta Daisakusen,https://myanimelist.net/anime/49236/Youjo_Senki__Sabaku_no_Pasta_Daisakusen,7.46,"Action, Fantasy, Isekai, Military, Reincarnation, Urban Fantasy",1,Premiered season not found,Nut,ONA,Light novel
2055,Yowamushi Pedal: Spare Bike,https://myanimelist.net/anime/33302/Yowamushi_Pedal__Spare_Bike,7.46,"Sports, Racing, Shounen",1,Premiered season not found,TMS Entertainment,Movie,Manga
2056,Yu☆Gi☆Oh! 5D's,https://myanimelist.net/anime/3972/Yu%E2%98%86Gi%E2%98%86Oh_5Ds,7.46,"Action, Strategy Game, Shounen",154,Spring 2008,Gallop,TV,Manga
2057,Zettai Karen Children: The Unlimited - Hyoubu Kyousuke,https://myanimelist.net/anime/16005/Zettai_Karen_Children__The_Unlimited_-_Hyoubu_Kyousuke,7.46,"Action, Super Power, Shounen",12,Winter 2013,Manglobe,TV,Manga
2058,Acchi Kocchi: Place=Princess,https://myanimelist.net/anime/16273/Acchi_Kocchi__Place_Princess,7.46,"Comedy, Romance, Gag Humor, School",1,Premiered season not found,AIC,Special,4-koma manga
2059,Angel Densetsu,https://myanimelist.net/anime/5251/Angel_Densetsu,7.46,"Action, Comedy, Delinquents, School",2,Premiered season not found,Toei Animation,OVA,Manga
2060,Benghuai: Xing Qiong Tiedao - Xuanhuang,https://myanimelist.net/anime/56471/Benghuai__Xing_Qiong_Tiedao_-_Xuanhuang,7.46,"Action, Fantasy, Sci-Fi",1,Premiered season not found,Red Dog Culture House,ONA,Source not found
2061,Boku no Hero Academia the Movie 2: Heroes:Rising - Epilogue Plus - Yume wo Genjitsu ni,https://myanimelist.net/anime/43683/Boku_no_Hero_Academia_the_Movie_2__Heroes_Rising_-_Epilogue_Plus_-_Yume_wo_Genjitsu_ni,7.46,Comedy,1,Premiered season not found,Bones,Special,Manga
2062,Carnival Phantasm EX Season,https://myanimelist.net/anime/12187/Carnival_Phantasm_EX_Season,7.46,"Comedy, Supernatural",1,Premiered season not found,Lerche,OVA,Manga
2063,City Hunter Movie: Shinjuku Private Eyes,https://myanimelist.net/anime/37516/City_Hunter_Movie__Shinjuku_Private_Eyes,7.46,"Action, Comedy, Mystery, Adult Cast, Shounen",1,Premiered season not found,Sunrise,Movie,Manga
2064,Da Li Si Rizhi 2nd Season,https://myanimelist.net/anime/50240/Da_Li_Si_Rizhi_2nd_Season,7.46,"Action, Comedy, Fantasy, Mystery, Anthropomorphic, Historical, Martial Arts, Mythology",12,Premiered season not found,Nice Boat Animation,ONA,Web manga
2065,Dead Mount Death Play Part 2,https://myanimelist.net/anime/54743/Dead_Mount_Death_Play_Part_2,7.46,"Action, Fantasy, Reincarnation, Urban Fantasy, Seinen",12,Fall 2023,Geek Toys,TV,Manga
2066,Donten ni Warau,https://myanimelist.net/anime/21743/Donten_ni_Warau,7.46,"Action, Supernatural, Historical, Shoujo",12,Fall 2014,Doga Kobo,TV,Manga
2067,Doraemon Movie 15: Nobita to Mugen Sankenshi,https://myanimelist.net/anime/2676/Doraemon_Movie_15__Nobita_to_Mugen_Sankenshi,7.46,"Adventure, Fantasy, Sci-Fi, Kids, Shounen",1,Premiered season not found,Shin-Ei Animation,Movie,Source not found
2068,Doraemon Movie 34: Shin Nobita no Daimakyou - Peko to 5-nin no Tankentai,https://myanimelist.net/anime/19645/Doraemon_Movie_34__Shin_Nobita_no_Daimakyou_-_Peko_to_5-nin_no_Tankentai,7.46,"Adventure, Comedy, Fantasy, Kids",1,Premiered season not found,Shin-Ei Animation,Movie,Source not found
2069,Dungeon ni Deai wo Motomeru no wa Machigatteiru Darou ka III,https://myanimelist.net/anime/40454/Dungeon_ni_Deai_wo_Motomeru_no_wa_Machigatteiru_Darou_ka_III,7.46,"Action, Adventure, Fantasy",12,Fall 2020,J.C.Staff,TV,Light novel
2070,Elfen Lied,https://myanimelist.net/anime/226/Elfen_Lied,7.46,"Action, Drama, Horror, Romance, Suspense, Gore, Psychological, Super Power, Seinen",13,Summer 2004,Arms,TV,Manga
2071,Fairy Tail OVA,https://myanimelist.net/anime/9982/Fairy_Tail_OVA,7.46,"Comedy, Fantasy, Ecchi, Shounen",5,Premiered season not found,Satelight,OVA,Manga
2072,Feng Ling Yu Xiu,https://myanimelist.net/anime/36184/Feng_Ling_Yu_Xiu,7.46,"Action, Adventure, Martial Arts",12,Premiered season not found,Sunflowers,ONA,Source not found
2073,Future GPX Cyber Formula Sin,https://myanimelist.net/anime/1395/Future_GPX_Cyber_Formula_Sin,7.46,"Drama, Sci-Fi, Racing",5,Premiered season not found,Sunrise,OVA,Source not found
2074,Grisaia no Kajitsu,https://myanimelist.net/anime/17729/Grisaia_no_Kajitsu,7.46,"Drama, Romance, Suspense, Harem, Psychological, School",13,Fall 2014,8bit,TV,Source not found
2075,Hidamari Sketch,https://myanimelist.net/anime/1852/Hidamari_Sketch,7.46,"Slice of Life, CGDCT, Iyashikei, School, Visual Arts",12,Winter 2007,Shaft,TV,4-koma manga
2076,Inazuma Eleven Go: Kyuukyoku no Kizuna Gryphon,https://myanimelist.net/anime/10999/Inazuma_Eleven_Go__Kyuukyoku_no_Kizuna_Gryphon,7.46,"Sci-Fi, Sports, Super Power, Team Sports",1,Premiered season not found,OLM,Movie,Source not found
2077,Junjou Romantica,https://myanimelist.net/anime/3092/Junjou_Romantica,7.46,"Boys Love, Comedy, Drama, Adult Cast",12,Spring 2008,Studio Deen,TV,Manga
2078,Kamikaze Kaitou Jeanne,https://myanimelist.net/anime/142/Kamikaze_Kaitou_Jeanne,7.46,"Action, Drama, Mystery, Romance, Supernatural, Mahou Shoujo, Mythology, Reincarnation, Shoujo",44,Winter 1999,Toei Animation,TV,Manga
2079,Lutu Weiji! Sheng Freya Hao Tebie Shijian,https://myanimelist.net/anime/58079/Lutu_Weiji_Sheng_Freya_Hao_Tebie_Shijian,7.46,"Comedy, Mystery, Sci-Fi, Space",1,Premiered season not found,HuaMei Animation,ONA,Source not found
2080,Mahoutsukai Precure! Movie: Kiseki no Henshin! Cure Mofurun!,https://myanimelist.net/anime/33183/Mahoutsukai_Precure_Movie__Kiseki_no_Henshin_Cure_Mofurun,7.46,"Action, Slice of Life, Mahou Shoujo, School",1,Premiered season not found,Toei Animation,Movie,Source not found
2081,Major 2nd 2nd Season,https://myanimelist.net/anime/40504/Major_2nd_2nd_Season,7.46,"Sports, Team Sports, Shounen",25,Spring 2020,OLM,TV,Manga
2082,Miira no Kaikata,https://myanimelist.net/anime/35828/Miira_no_Kaikata,7.46,"Slice of Life, Supernatural, Mythology, Pets, School",12,Winter 2018,8bit,TV,Web manga
2083,Naruto: Shippuuden Movie 5 - Blood Prison,https://myanimelist.net/anime/10589/Naruto__Shippuuden_Movie_5_-_Blood_Prison,7.46,"Action, Adventure, Fantasy, Shounen",1,Premiered season not found,Pierrot,Movie,Manga
2084,Orange: Mirai,https://myanimelist.net/anime/34136/Orange__Mirai,7.46,"Drama, Romance, Sci-Fi, School, Time Travel, Shoujo",1,Premiered season not found,Telecom Animation Film,Movie,Manga
2085,Ouritsu Uchuugun: Honneamise no Tsubasa,https://myanimelist.net/anime/1034/Ouritsu_Uchuugun__Honneamise_no_Tsubasa,7.46,"Action, Award Winning, Drama, Sci-Fi, Military, Space",1,Premiered season not found,Gainax,Movie,Source not found
2086,Oushitsu Kyoushi Heine,https://myanimelist.net/anime/34262/Oushitsu_Kyoushi_Heine,7.46,"Comedy, Historical, Shounen",12,Spring 2017,Bridge,TV,Manga
2087,Kaleido Star: Aratanaru Tsubasa - Extra Stage,https://myanimelist.net/anime/428/Kaleido_Star__Aratanaru_Tsubasa_-_Extra_Stage,7.45,"Adventure, Comedy, Drama, Performing Arts",1,Premiered season not found,Gonzo,OVA,Source not found
2088,Kara no Kyoukai Movie: Mirai Fukuin - Extra Chorus,https://myanimelist.net/anime/22763/Kara_no_Kyoukai_Movie__Mirai_Fukuin_-_Extra_Chorus,7.45,"Drama, Mystery, Supernatural",1,Premiered season not found,ufotable,Special,Manga
2089,Kengan Ashura,https://myanimelist.net/anime/36903/Kengan_Ashura,7.45,"Action, Martial Arts",12,Premiered season not found,Larx Entertainment,ONA,Web manga
2090,Kin no Kuni Mizu no Kuni,https://myanimelist.net/anime/52186/Kin_no_Kuni_Mizu_no_Kuni,7.45,"Fantasy, Romance, Josei",1,Premiered season not found,Madhouse,Movie,Manga
2091,Kishuku Gakkou no Juliet,https://myanimelist.net/anime/37475/Kishuku_Gakkou_no_Juliet,7.45,"Action, Comedy, Romance, School, Shounen",12,Fall 2018,LIDENFILMS,TV,Manga
2092,"Kumo desu ga, Nani ka?",https://myanimelist.net/anime/37984/Kumo_desu_ga_Nani_ka,7.45,"Action, Adventure, Comedy, Fantasy, Mystery, Isekai, Reincarnation",24,Winter 2021,Millepensee,TV,Light novel
2094,Lady Jewelpet,https://myanimelist.net/anime/22693/Lady_Jewelpet,7.45,"Fantasy, Romance, Anthropomorphic, Mahou Shoujo",52,Spring 2014,Studio Comet,TV,Source not found
2095,Lady Lady!!,https://myanimelist.net/anime/2227/Lady_Lady,7.45,"Drama, Historical, Shoujo",21,Fall 1987,Toei Animation,TV,Manga
2096,Magic Knight Rayearth,https://myanimelist.net/anime/435/Magic_Knight_Rayearth,7.45,"Action, Adventure, Comedy, Drama, Fantasy, Isekai, Mecha, Shoujo",20,Fall 1994,Tokyo Movie Shinsha,TV,Manga
2097,Mahouka Koukou no Rettousei Movie: Hoshi wo Yobu Shoujo,https://myanimelist.net/anime/32900/Mahouka_Koukou_no_Rettousei_Movie__Hoshi_wo_Yobu_Shoujo,7.45,"Action, Fantasy, Sci-Fi, Urban Fantasy",1,Premiered season not found,8bit,Movie,Light novel
2098,Motto! Ojamajo Doremi,https://myanimelist.net/anime/352/Motto_Ojamajo_Doremi,7.45,"Comedy, Fantasy",50,Winter 2001,Toei Animation,TV,Source not found
2099,Ojamajo Doremi Sharp,https://myanimelist.net/anime/351/Ojamajo_Doremi_Sharp,7.45,"Comedy, Fantasy, Childcare",49,Winter 2000,Toei Animation,TV,Source not found
2100,Otome Game no Hametsu Flag shika Nai Akuyaku Reijou ni Tensei shiteshimatta...,https://myanimelist.net/anime/38555/Otome_Game_no_Hametsu_Flag_shika_Nai_Akuyaku_Reijou_ni_Tensei_shiteshimatta,7.45,"Comedy, Fantasy, Romance, Isekai, Reverse Harem, School, Villainess, Shoujo",12,Spring 2020,SILVER LINK.,TV,Light novel
2101,Paniponi Dash!: Danjite Okonaeba Kishin mo Kore wo Saku,https://myanimelist.net/anime/5419/Paniponi_Dash__Danjite_Okonaeba_Kishin_mo_Kore_wo_Saku,7.45,"Comedy, Gag Humor, Parody, School, Shounen",1,Premiered season not found,Shaft,Special,Manga
2102,Saki,https://myanimelist.net/anime/5671/Saki,7.45,"Slice of Life, School, Strategy Game, Seinen",25,Spring 2009,Gonzo,TV,Manga
2103,Senki Zesshou Symphogear GX,https://myanimelist.net/anime/21573/Senki_Zesshou_Symphogear_GX,7.45,"Action, Sci-Fi, Idols (Female), Music",13,Summer 2015,Satelight,TV,Source not found
2105,Shokugeki no Souma: Ni no Sara OVA,https://myanimelist.net/anime/34480/Shokugeki_no_Souma__Ni_no_Sara_OVA,7.45,"Gourmet, Ecchi, School, Shounen",2,Premiered season not found,J.C.Staff,OVA,Manga
2106,Shokugeki no Souma: San no Sara - Kyokuseiryou no Erina,https://myanimelist.net/anime/36962/Shokugeki_no_Souma__San_no_Sara_-_Kyokuseiryou_no_Erina,7.45,"Drama, Shounen",1,Premiered season not found,J.C.Staff,OVA,Manga
2107,Sidonia no Kishi: Ai Tsumugu Hoshi,https://myanimelist.net/anime/35759/Sidonia_no_Kishi__Ai_Tsumugu_Hoshi,7.45,"Action, Sci-Fi, Mecha, Space, Seinen",1,Premiered season not found,Polygon Pictures,Movie,Manga
2108,Soredemo Machi wa Mawatteiru,https://myanimelist.net/anime/8726/Soredemo_Machi_wa_Mawatteiru,7.45,"Slice of Life, Workplace, Seinen",12,Fall 2010,Shaft,TV,Manga
2109,Super Cub,https://myanimelist.net/anime/40685/Super_Cub,7.45,"Slice of Life, CGDCT, Iyashikei, School",12,Spring 2021,Studio Kai,TV,Light novel
2110,Suzumiya Haruhi-chan no Yuuutsu,https://myanimelist.net/anime/5118/Suzumiya_Haruhi-chan_no_Yuuutsu,7.45,"Comedy, Parody",25,Premiered season not found,Kyoto Animation,ONA,4-koma manga
2111,Taiho Shichau zo,https://myanimelist.net/anime/1577/Taiho_Shichau_zo,7.45,"Action, Comedy, Detective, Workplace, Seinen",4,Premiered season not found,Studio Deen,OVA,Manga
2112,Tennis no Oujisama: Another Story II - Ano Toki no Bokura,https://myanimelist.net/anime/10573/Tennis_no_Oujisama__Another_Story_II_-_Ano_Toki_no_Bokura,7.45,"Comedy, Sports, School, Shounen",4,Premiered season not found,M.S.C,OVA,Manga
2113,The iDOLM@STER: 765 Pro to Iu Monogatari,https://myanimelist.net/anime/11889/The_iDOLMSTER__765_Pro_to_Iu_Monogatari,7.45,"Comedy, Drama, Idols (Female), Music",1,Premiered season not found,A-1 Pictures,Special,Source not found
2114,Urusei Yatsura Movie 5: Kanketsu-hen,https://myanimelist.net/anime/1924/Urusei_Yatsura_Movie_5__Kanketsu-hen,7.45,"Action, Adventure, Comedy, Drama, Romance, Sci-Fi, Shounen",1,Premiered season not found,Magic Bus,Movie,Manga
2115,Vinland Saga Season 2: Drowning in the Shadow,https://myanimelist.net/anime/54463/Vinland_Saga_Season_2__Drowning_in_the_Shadow,7.45,"Action, Adventure, Drama, Gore, Historical, Seinen",1,Premiered season not found,MAPPA,ONA,Manga
2116,Yaoguai Mingdan 2nd Season,https://myanimelist.net/anime/36160/Yaoguai_Mingdan_2nd_Season,7.45,"Action, Comedy, Fantasy, Romance",21,Premiered season not found,Haoliners Animation League,ONA,Web manga
2117,Yozakura Quartet: Tsuki ni Naku,https://myanimelist.net/anime/18499/Yozakura_Quartet__Tsuki_ni_Naku,7.45,"Action, Comedy, Supernatural, Super Power, Shounen",3,Premiered season not found,Tatsunoko Production,OVA,Manga
2118,Yuan Zun,https://myanimelist.net/anime/50114/Yuan_Zun,7.45,"Action, Adventure, Fantasy, Martial Arts",26,Premiered season not found,Motion Magic,ONA,Source not found
2119,Amagi Brilliant Park,https://myanimelist.net/anime/22147/Amagi_Brilliant_Park,7.45,"Comedy, Fantasy, Workplace",13,Fall 2014,Kyoto Animation,TV,Light novel
2120,Angel Beats! Another Epilogue,https://myanimelist.net/anime/10067/Angel_Beats_Another_Epilogue,7.45,"Fantasy, School",1,Premiered season not found,P.A. Works,Special,Source not found
2121,Burn the Witch #0.8,https://myanimelist.net/anime/56671/Burn_the_Witch_08,7.45,"Action, Fantasy, Shounen",1,Premiered season not found,Studio Colorido,TV Special,Manga
